TVShowId,Title,Popularity,Overview,ReleaseDate,PosterPath
10534,The Red Skelton Show,216.973,"The Red Skelton Show is an American variety show that was a television staple for two decades, from 1951 to 1971. It was second to Gunsmoke and third to The Ed Sullivan Show in the ratings during that time. Skelton, who had previously been a radio star, had appeared in several motion pictures as well. Although his television series is largely associated with CBS, where it appeared for more than fifteen years, it actually began and ended on NBC. During its run, the program received three Emmy Awards, for Skelton as best comedian and the program as best comedy show during its initial season, and an award for comedy writing in 1961.",1951-09-30,https://image.tmdb.org/t/p/w500/6e54gnblIDcwDGOGhzPyV0fB6Rw.jpg
273327,Black Point,216.206,"“Black Point” takes place in a social romantic setting, exploring the complex relationships between its diverse characters.",2024-11-11,https://image.tmdb.org/t/p/w500/xrGx7uRbCc9qwU76YD2wJXL56Js.jpg
76669,Elite,215.961,"When three working class kids enroll in the most exclusive school in Spain, the clash between the wealthy and the poor students leads to tragedy.",2018-10-05,https://image.tmdb.org/t/p/w500/3NTAbAiao4JLzFQw6YxP1YZppM8.jpg
259140,Ranma1/2,214.995,"Akane Tendo meets her new fiancé, Ranma Saotome, a martial arts prodigy with a twist: he magically transforms into a girl upon touching cold water.",2024-10-06,https://image.tmdb.org/t/p/w500/zQhwc27CWHM4zx9lJU9bI5FRQOm.jpg
112888,True Beauty,214.761,"Lim Ju-kyung is a high school student. Since she was little, she has had a complex about her appearance. To hide her bare face, Ju-kyung always wears make-up. Her excellent make-up skills make her pretty and she hides her bare face in front of others. She gets involved with 2 men; Lee Su-ho and Han Seo-jun.",2020-12-09,https://image.tmdb.org/t/p/w500/sld43SJArZqlnANJabq8R5wdOZk.jpg
14210,Polizeiruf 110,214.257,"Polizeiruf 110 is a long-running German language detective television series. The first episode was broadcast 27 June 1971 in the German Democratic Republic, and after the dissolution of Fernsehen der DDR the series was picked up by ARD. It was originally created as a counterpart to the West German series Tatort, and quickly became a public favorite.",1971-06-27,https://image.tmdb.org/t/p/w500/6ZZadTzWhvC6msfEm5G4F4IFgBY.jpg
117993,Still You,212.92,,2012-05-12,https://image.tmdb.org/t/p/w500/xy8rmROqxsIhqziWOe6swnjjUsk.jpg
1636,Top of the Pops,212.797,"The biggest stars, the most iconic performances, the most outrageous outfits – it’s Britain’s number one pop show.",1964-01-01,https://image.tmdb.org/t/p/w500/jjfTTjVYWyD6rGHVbnC44IrsJ7P.jpg
2327,Dawson's Creek,211.76,Dawson's Creek is an American teen drama that portrays the fictional lives of a close-knit group of teenagers through high school and college.,1998-01-20,https://image.tmdb.org/t/p/w500/arT93dBemanftfWTcf9I0JRIlxU.jpg
253,Star Trek,210.319,"Space. The Final Frontier. The U.S.S. Enterprise embarks on a five year mission to explore the galaxy. The Enterprise is under the command of Captain James T. Kirk with First Officer Mr. Spock, from the planet Vulcan. With a determined crew, the Enterprise encounters Klingons, Romulans, time paradoxes, tribbles and genetic supermen led by Khan Noonian Singh. Their mission is to explore strange new worlds, to seek new life and new civilizations, and to boldly go where no man has gone before.",1966-09-08,https://image.tmdb.org/t/p/w500/bPsxOpHVpVCX3hFz2fxnF1Vz3Dj.jpg
46298,Hunter x Hunter,209.993,"Twelve-year-old Gon Freecss one day discovers that the father he had always been told was dead was alive. His Father, Ging, is a Hunter — a member of society's elite with a license to go anywhere or do almost anything. Gon, determined to follow in his father's footsteps, decides to take the Hunter Examination and eventually find his father to prove himself as a Hunter in his own right. But on the way, he learns that there is more to becoming a Hunter than previously thought, and the challenges that he must face are considered the toughest in the world.",2011-10-02,https://image.tmdb.org/t/p/w500/ucpgmUR1h5Te1BYegKItoPjOeF7.jpg
136311,Shrinking,209.589,"Jimmy is struggling to grieve the loss of his wife while being a dad, friend, and therapist. He decides to try a new approach with everyone in his path: unfiltered, brutal honesty.",2023-01-26,https://image.tmdb.org/t/p/w500/cVmrNYgm5wcEexbXg4laNn3u4vq.jpg
228091,HK 80's,209.481,"This sitcom  series premiered in 1981 and changed its name every year, from ""Hong Kong 81"" to ""Hong Kong 86."" It was eventually replaced by a new sitcom called ""City Stories."" A total of 1330 episodes were produced, making it the second-longest-running series in Hong Kong, after ""Come Home Love: Lo and Behold"".

Each episode of this series is inspired by current social issues, with early storylines often satirizing society's flaws. The characters, such as ""Chen Ji,"" ""Mrs. Shun,"" ""Uncle Mao,"" ""Jue Wu Yin,"" ""Miss Su,"" ""A Wei,"" and ""Ah Kang,"" mostly hail from the grassroots, leaving a lasting impression on the audience. For example, ""Mrs. Shun,"" portrayed by Lydia Shum, later became a term to describe uneducated women who follow trends blindly. ""Chen Ji,"" played by Lawrence Ng, is a stockbroker who loves to show off his wealth, and his behavior typified that of many Hong Kongers, becoming a byword for the city's nouveau riche.",1981-06-08,https://image.tmdb.org/t/p/w500/6IpuLrhh7XZfIvz0OmFOSJdSORe.jpg
3452,Frasier,209.194,"After many years spent at the “Cheers” bar, Frasier moves back home to Seattle to work as a radio psychiatrist after his policeman father gets shot in the hip on duty.",1993-09-16,https://image.tmdb.org/t/p/w500/gYAb6GCVEFsU9hzMCG5rxaxoIv3.jpg
49011,Mom,207.705,"Aan irreverent and outrageous take on true family love‐and dysfunction. Newly sober single mom Christy struggles to raise two children in a world full of temptations and pitfalls. Testing her sobriety is her formerly estranged mother, now back in Christy's life and eager to share passive-aggressive insights into her daughter's many mistakes.",2013-09-23,https://image.tmdb.org/t/p/w500/kIi3T7X0kmiV9vGDme146P2d979.jpg
162,Night Court,207.599,An eccentric fun-loving judge presides over an urban night court and all the silliness going on there.,1984-01-04,https://image.tmdb.org/t/p/w500/bpEVtr4NCkbmTdponemKSjt9POc.jpg
38464,Blue Exorcist,206.375,"Humans live in the world of Assiah, demons in Gehenna. The two dimensions are not meant to interfere with each other, but demons still possess creatures in Assiah in spite of this. The humans who can fight these demons are known as exorcists. Rin Okumura is a boy who bears the curse of being Satan's illegitimate son. His foster father sacrificed himself to save him from demons. To avenge his foster father's death as well as to prove himself, Rin decides to follow the path of an exorcist and defeat his own father, Satan. To hone his raw skills, Rin enters True Cross Academy to train with other exorcist candidates.",2011-04-17,https://image.tmdb.org/t/p/w500/kpNoqNmElzGUEcEoZyfFwvYXMsR.jpg
12637,Rebelde,205.852,Six teenagers with different lives and personalities attend a prominent private school with only one thing in common: their vocation and passion for music.,2004-10-04,https://image.tmdb.org/t/p/w500/kQHXg2BOiODkF4yVI75NcodMmAJ.jpg
12301,Naked News,205.459,"A real television newscast, the show is prepared in Toronto and runs daily, with 25-minute episodes 6 days per week. The female anchors read the news fully nude or strip as they present their news segments.",2005-11-20,https://image.tmdb.org/t/p/w500/kZZl47H5zlM8z1Rqe39h46NC17K.jpg
220056,The Madness,205.289,"After a media pundit stumbles upon a dead body deep in the Poconos woods, he finds himself framed for the murder of a notorious white supremacist.",2024-11-28,https://image.tmdb.org/t/p/w500/z3KaWe2r0yBaRbQlH7BPOR5fpnL.jpg
241002,Adam's Sweet Agony,204.963,"This is the story of a boy, who became the lone Adam among four billion Eves. In a world where a pandemic has rendered all men impotent, high school student Itsuki is the exception who escaped it. In order to protect this secret, he transfers to a very special high school, which turns out to be composed of 90% girls! There, he encounters an upbeat and friendly senior, a sexually frustrated female teacher, a tomboyish school 'prince,' and an heiress from a wealthy family. For Itsuki, who has his pick of any woman in the world, the question remains: which one will he choose?",2024-01-08,https://image.tmdb.org/t/p/w500/1n1ZP0KHXUSvVxZG63x7aOzmO4M.jpg
16656,Fuse,203.912,"Fitil is a popular Soviet/Russian television satirical/comedy short film series which ran for about 500 episodes. Some of the episodes were aimed at children, and were called Фитилёк, Fitilyok, Little Fuse. Each issue contained from the few short segments: documentary, fictional and animated ones. Directed by various artists, including Leonid Gaidai who presented his famous trio of Nikulin, Vitsin and Morgunov into the cast. It was called in USSR as ""the anecdotes from the Soviet government"".",1962-06-04,https://image.tmdb.org/t/p/w500/dBgJKqZnmfARnN8bkaA7elWjhz9.jpg
22634,Shakugan no Shana,203.777,"The world has become a slaughtering ground for the Crimson Denizens, mysterious beings from a parallel universe who thrive on the life energy of humans. These merciless murderers only leave behind scant remainders of souls called ""Torches,"" which are mere residues that will eventually be destroyed, along with the very fact of the victims' existence from the minds of the living. In an ambitious endeavor to put an end to this invisible, hungry massacre, warriors called Flame Hazes relentlessly fight these monsters.

One fateful day, Yuuji Sakai ceases to be a regular high schooler—he becomes trapped in a crevice of time and is suddenly attacked by a Denizen. Coming to his rescue just in the nick of time is a nameless hunter who seems no different from an ordinary young girl except for her blazing eyes and burning crimson hair. However, before Yuuji can learn anything more about his situation, he discovers that he has already been reduced to a Torch—merely a scrap of memory waiting to be extinguished.",2005-10-06,https://image.tmdb.org/t/p/w500/sesXxmmb2TZ9uq6ETIkOQkxK1wV.jpg
32209,Al Fondo Hay Sitio,203.734,"Al fondo hay sitio is a Peruvian TV series created in 2008-2009 by Efraín Aguilar. It deals with the problems of social differences and economic status. It's one of the most popular shows in Peru and is now being shown in Ecuador, Bolivia, Paraguay and Uruguay.",2009-03-30,https://image.tmdb.org/t/p/w500/g7cuCCkvoBuSwemTHYz3k0hvvmz.jpg
195384,Shin Nihon Fudoki,203.448,"A full-scale travel documentary program that portrays the beautiful landscapes, lifestyles, and activities of people across various regions in Japan. Presented in an omnibus format, it allows viewers to immerse themselves in the nostalgic and irreplaceable scenery of Japan.",2011-04-01,https://image.tmdb.org/t/p/w500/iTXgp44o1NcZ66RQdU9AtM5U1FK.jpg
248947,FAIRY TAIL 100 YEARS QUEST,202.511,"The rowdiest guild in Fiore Kingdom is back! Natsu, Lucy, Gray, Erza, and the whole Fairy Tail guild tackle the legendary ""100 Years Quest,"" tougher than any S-Class quest. Their goal: find the first wizard guild ever, located in the far north of Guiltina. Facing new gods, mysterious towns, and ominous foes, they’ll have their work cut out for them. Will they succeed where no wizard has before?",2024-07-07,https://image.tmdb.org/t/p/w500/wj5i6YgZj7LltRE3yE6VTgfdbK0.jpg
13700,Indian Idol,202.458,The Indian version of the Pop Idol format.,2004-10-28,https://image.tmdb.org/t/p/w500/igtVLnrSyMwPYtuWGFRSk3wlPel.jpg
94664,Mushoku Tensei: Jobless Reincarnation,202.008,"A 34-year-old hikikomori is kicked out of his home by his family after the death of his parents. After his eviction, he saves a group of teenagers from being killed by a speeding truck, but loses his life in the process. When he comes to, he realizes he has been reborn as Rudeus Greyrat, in a world of swords and sorcery.",2021-01-11,https://image.tmdb.org/t/p/w500/gLKOYIMyKlUHW0SVdskhgf9C0yy.jpg
1409,Sons of Anarchy,201.447,"The Sons of Anarchy (SOA) is an outlaw motorcycle club with many charters in the United States as well as overseas. The show focused on the original and founding (mother) charter, Sons of Anarchy Motorcycle Club, Redwood Original, often referred to by the acronym SAMCRO, Sam Crow, or simply Redwood charter. the charter operates both illegal and legal businesses in the small town of Charming. They combine gun-running and a garage, plus involvement in porn film. Clay, the president, likes it old school and violent; while Jax, his stepson and the club's VP, has thoughts about changing the way things are. Their conflict has effects on both the club and their personal relationship. especially When Jackson ""Jax"" Teller discovers that his father had a different view in mind for SAMCRO (Sons of Anarchy Motorcycle Club Redwood Original) he goes on a personal quest to cleanse the name and make the club a better place, but at what cost?",2008-09-03,https://image.tmdb.org/t/p/w500/kiy8BHtIHAslh81rvFcZ4wbNGdY.jpg
1413,American Horror Story,201.42,"An anthology horror drama series centering on different characters and locations, including a house with a murderous past, an asylum, a witch coven, a freak show, a hotel, a farmhouse in Roanoke, a cult, the apocalypse and a summer camp.",2011-10-05,https://image.tmdb.org/t/p/w500/5LLG9bjq0i7V5N4UfRhnab8zHK4.jpg
1973,24,201.279,"Counterterrorism agent Jack Bauer fights the bad guys of the world, a day at a time. With each week's episode unfolding in real-time, ""24"" covers a single day in the life of Bauer each season.",2001-11-06,https://image.tmdb.org/t/p/w500/iq6yrZ5LEDXf1ArCOYLq8PIUBpV.jpg
1606,Ghost Whisperer,201.248,"Newlywed Melinda Gordon tries to help the dead communicate with loved ones, but sometimes the messages she receives are intense and confusing. Most of Melinda's efforts involve resolving conflicts that are preventing the spirits from passing over.",2005-09-23,https://image.tmdb.org/t/p/w500/nIboXXCporMO9Xskq7Rsf45Z6qW.jpg
202979,"Welcome Back For An Extracurricular Lesson, Sempai",200.966,,1998-04-02,https://image.tmdb.org/t/p/w500/3Csu6Hk7FlFaepdUBT3FhCCLf6n.jpg
90,Mayday,200.881,"Major real-life air disasters are depicted in this series. Each episode features a detailed dramatized reconstruction of the incident based on cockpit voice recorders and air traffic control transcripts, as well as eyewitnesses recounts and interviews with aviation experts.",2003-09-03,https://image.tmdb.org/t/p/w500/2uuVIAb4MtPmMNTpOyID5V8DzrU.jpg
154825,Business Proposal,200.816,"In disguise as her friend, Ha-ri shows up to a blind date to scare him away. But plans go awry when he turns out to be her CEO — and makes a proposal.",2022-02-28,https://image.tmdb.org/t/p/w500/iLh7L8ZuvgdxFaM9sImyv2iKYLe.jpg
31917,Pretty Little Liars,200.128,"Based on the Pretty Little Liars series of young adult novels by Sara Shepard, the series follows the lives of four girls — Spencer, Hanna, Aria, and Emily — whose clique falls apart after the disappearance of their queen bee, Alison. One year later, they begin receiving messages from someone using the name ""A"" who threatens to expose their secrets — including long-hidden ones they thought only Alison knew.",2010-06-08,https://image.tmdb.org/t/p/w500/yrObh12XoSzRtHRAfHbcVDtkxjn.jpg
226285,Elsbeth,199.909,"After her successful career in Chicago, Elsbeth Tascioni, an astute but unconventional attorney, utilizes her singular point of view to make unique observations and corner brilliant criminals alongside the NYPD.",2024-02-29,https://image.tmdb.org/t/p/w500/4sbCGmIHInP6EiLhvpMC6SxBnYd.jpg
42009,Black Mirror,199.667,"Over the last ten years, technology has transformed almost every aspect of our lives before we've had time to stop and question it. In every home; on every desk; in every palm - a plasma screen; a monitor; a smartphone - a black mirror of our 21st Century existence.",2011-12-04,https://image.tmdb.org/t/p/w500/5UaYsGZOFhjFDwQh6GuLjjA1WlF.jpg
224,Match of the Day,198.761,"BBC's football highlights and analysis.

""The longest-running football television programme in the world"" as recognised by Guinness World Records in 2015.",1964-08-22,https://image.tmdb.org/t/p/w500/aA25JrHXj8ZPTJYj2iSIueyb34C.jpg
4239,Married... with Children,198.637,"Al Bundy is an unsuccessful middle aged shoe salesman with a miserable life and an equally dysfunctional family. He hates his job, his wife is lazy, his son is dysfunctional (especially with women), and his daughter is dim-witted and promiscuous.",1987-04-05,https://image.tmdb.org/t/p/w500/qxdOgESOkBMmfcWUizL01mbdqzl.jpg
63333,The Last Kingdom,197.746,"A show of heroic deeds and epic battles with a thematic depth that embraces politics, religion, warfare, courage, love, loyalty and our universal search for identity. Combining real historical figures and events with fictional characters, it is the story of how a people combined their strength under one of the most iconic kings of history in order to reclaim their land for themselves and build a place they call home.",2015-10-10,https://image.tmdb.org/t/p/w500/8eJf0hxgIhE6QSxbtuNCekTddy1.jpg
139797,Under The Skin,197.433,"Young artist Shen Yi's life changes when a commission leads to a police case gone wrong. Seven years later, he joins the Criminal Investigation Unit as a portraitist alongside Captain Du Cheng.",2022-03-06,https://image.tmdb.org/t/p/w500/rehfB4Yz7op8qGQBHppXnpWae9o.jpg
111453,Ghum Hai Kisikey Pyaar Meiin,197.105,"Virat sacrifices his love to honour the promise he made to a dying man. Trapped between the past and the present, will he find love beyond the chains of duty?",2020-10-05,https://image.tmdb.org/t/p/w500/u3NVGYCpkAgBArXogLuHPfpSNwG.jpg
498,Late Show with David Letterman,197.039,"Late Show with David Letterman is an American late-night talk show hosted by David Letterman on CBS. The show debuted on August 30, 1993, and is produced by Letterman's production company, Worldwide Pants Incorporated and CBS Television Studios. The show's music director and band-leader of the house band, the CBS Orchestra, is Paul Shaffer. The head writer is Matt Roberts and the announcer is Alan Kalter. Of the major U.S. late-night programs, Late Show ranks second in cumulative average viewers over time and third in number of episodes over time. The show leads other late night shows in ad revenue with $271 million in 2009.

In most U.S. markets the show airs at 11:35 p.m. Eastern/Pacific time, but is recorded Monday through Wednesday at 4:30 p.m., and Thursdays at 3:30 p.m and 6:00 p.m. The second Thursday episode usually airs on Friday of that week.

In 2002, Late Show with David Letterman was ranked No. 7 on TV Guide's 50 Greatest TV Shows of All Time. CBS has a contract with Worldwide Pants to continue the show through 2014; by then, Letterman will surpass Johnny Carson as the longest tenured late-night talk show host.",1993-08-30,https://image.tmdb.org/t/p/w500/7dwM8AKyQfauguoQbI1MIlHinLM.jpg
615,Futurama,196.982,"The adventures of a late-20th-century New York City pizza delivery boy, Philip J. Fry, who, after being unwittingly cryogenically frozen for one thousand years, finds employment at Planet Express, an interplanetary delivery company in the retro-futuristic 31st century.",1999-03-28,https://image.tmdb.org/t/p/w500/sdJcX2cXirwQurLLlrDLYov7hcD.jpg
42705,Fighting Spirit,195.159,"Makunouchi Ippo is an ordinary high school student in Japan. Since he spends most of his time away from school helping his mother run the family business, he doesn't get to enjoy his younger years like most teenagers. Always a target for bullying at school (the family fishing business grants him a distinct odor), Ippo's life is one of hardship. One of these after-school bullying sessions turns Ippo's life around for the better, as he is saved by a boxer named Takamura. He decides to follow in Takamura's footsteps and train to become a boxer, giving his life direction and purpose. Ippo's path to perfecting his pugilistic prowess is just beginning...",2000-10-03,https://image.tmdb.org/t/p/w500/qC4taY6yB9BWJ8IxcbnXR8yUS4o.jpg
121232,Palace of Devotion,195.017,"Orphaned as a child, Liu E travels to the capital Kaifeng, and later catches the eye of Zhao Heng. Though she was a concubine, Liu E was perceptive to state affairs, and often discussed politics with Zhao Heng. This tradition continued when he became emperor in 997.

Liu E is crowned empress after adopting the son of  a concubine (later Emperor Renzong), and serves as regent of the Song Dynasty during the last two years of her husband’s reign. Liu E would continue to rule until her death twelve years later in 1033.",2021-03-20,https://image.tmdb.org/t/p/w500/a5hDykPND75bSLJBWn5c6ws5bsQ.jpg
247721,Teacup,194.567,"Trapped on a farm in rural Georgia, a group of neighbours must put aside their differences and unite in the face of a mysterious and deadly threat.",2024-10-10,https://image.tmdb.org/t/p/w500/cP5zuQvWAFrgWptS0iXvDI3iND.jpg
91239,Bridgerton,194.556,"Wealth, lust, and betrayal set in the backdrop of Regency era England, seen through the eyes of the powerful Bridgerton family.",2020-12-25,https://image.tmdb.org/t/p/w500/luoKpgVwi1E5nQsi7W0UuKHu2Rq.jpg
32726,Bob's Burgers,193.927,"Bob's Burgers follows a third-generation restaurateur, Bob, as he runs Bob's Burgers with the help of his wife and their three kids. Bob and his quirky family have big ideas about burgers, but fall short on service and sophistication. Despite the greasy counters, lousy location and a dearth of customers, Bob and his family are determined to make Bob's Burgers ""grand re-re-re-opening"" a success.",2011-01-09,https://image.tmdb.org/t/p/w500/yVz5foNr6nCfathj0igg8RLVGfn.jpg
63770,The Late Show with Stephen Colbert,193.222,"Stephen Colbert brings his signature satire and comedy to The Late Show with Stephen Colbert, the #1 show in late night, where he talks with an eclectic mix of guests about what is new and relevant in the worlds of politics, entertainment, business, music, technology, and more. Featuring bandleader Jon Batiste with his band Stay Human, the Emmy Award-nominated show is broadcast from the historic Ed Sullivan Theater. Stephen Colbert, Chris Licht, Tom Purcell, and Jon Stewart are executive producers. Barry Julien and Denise Rehrig serve as co-executive producers.must watch",2015-09-08,https://image.tmdb.org/t/p/w500/9jkThAGYj2yp8jsS6Nriy5mzKFT.jpg
97072,Charmsukh,192.434,"Charmsukh is an erotic, drama web-series streamed on ULLU network with each episode having unique storyline.",2019-11-22,https://image.tmdb.org/t/p/w500/6Kt9zIsrtqs1x1XyNFxOeEjlkKB.jpg
126308,Shōgun,192.361,"In Japan in the year 1600, at the dawn of a century-defining civil war, Lord Yoshii Toranaga is fighting for his life as his enemies on the Council of Regents unite against him, when a mysterious European ship is found marooned in a nearby fishing village.",2024-02-27,https://image.tmdb.org/t/p/w500/7O4iVfOMQmdCSxhOg1WnzG1AgYT.jpg
269,One Tree Hill,192.11,"In Tree Hill, North Carolina two half brothers share a last name and nothing else. Brooding, blue-collar Lucas is a talented street-side basketball player, but his skills are appreciated only by his friends at the river court. Popular, affluent Nathan basks in the hero-worship of the town, as the star of his high school team. And both boys are the son of former college ball player Dan Scott whose long ago choice to abandon Lucas and his mother Karen, will haunt him long into his life with wife Deb and their son Nathan.",2003-09-23,https://image.tmdb.org/t/p/w500/sOrelBaAhp7DZbPTivDwKEyPslC.jpg
79141,Scissor Seven,192.027,"Seeking to recover his memory, a scissor-wielding, hairdressing, bungling quasi-assassin stumbles into a struggle for power among feuding factions.",2018-04-25,https://image.tmdb.org/t/p/w500/nuovZ11MA2pHx6xQVpOFc6Jl1V0.jpg
128757,미우나 고우나,191.717,It deals with the appearance of a middle-aged remarriage family.,2007-09-03,https://image.tmdb.org/t/p/w500/QJH1SQDMwWlK52bD3brCEqDYlQ.jpg
225634,Monsters,191.567,"The story of the Menéndez brothers, who were convicted in 1996 of murdering their parents José and Mary Louise “Kitty” Menéndez.",2024-09-19,https://image.tmdb.org/t/p/w500/x9YC2rpXHUFMqI1hCekKDm9UE4w.jpg
154524,Urusei Yatsura,191.533,"Tokyo. Tomobiki Town. Lum, the gorgeous daughter of an invading race of Oni Aliens is smitten with High School student Ataru Moroboshi. A dedicated womanizer, Ataru is unfazed by Lum’s fierce electric shock attacks and continues his daily hunt for pretty girls. With a host of other unique characters, including classmate Shinobu, elegant shrine maiden Sakura, Lum’s best friend’s Oyuki, Benten and Ran, Buddhist Monk Cherry, Ten, the little brat, heir to a wealthy family Shutaro Mendo and the secretly female beauty Ryunosuke… A classic slapstick love comedy where anything goes!",2022-10-14,https://image.tmdb.org/t/p/w500/vzOSTRN7ThklByHIMKHRYDO2cfV.jpg
127231,Shooting Stars,191.103,"Female soccer teams comprised of celebrities and non celebrities, working together to battle it out on the soccer field. Most have little soccer experience, but with the coaching from various Korean soccer legends, the team members grow with a fierce passion that leads to inspiring victories and regretful losses. Each team is grouped by certain types i.e. comedians, models, foreigners, actresses, etc. Unpredictable and exciting, the games are filled with fun intensity and emotions on high.",2021-06-16,https://image.tmdb.org/t/p/w500/qJsELNZ2fJcI3tPuzM3wTZLjsWh.jpg
