TVShowId,Title,Popularity,Overview,ReleaseDate,PosterPath
873,Columbo,350.378,"Columbo is a friendly, verbose, disheveled-looking police detective who is consistently underestimated by his suspects. Despite his unprepossessing appearance and apparent absentmindedness, he shrewdly solves all of his cases and secures all evidence needed for indictment. His formidable eye for detail and meticulously dedicated approach often become clear to the killer only late in the storyline.",1971-09-15,https://image.tmdb.org/t/p/w500/2JCD8vab3fircOU8cM2HJCxfv4I.jpg
157741,Landman,350.322,"Set in the proverbial boomtowns of West-Texas and a modern-day tale of fortune-seeking in the world of oil rigs, the series is an upstairs/downstairs story of roughnecks and wildcat billionaires that are fueling a boom so big it’s reshaping our climate, our economy and our geopolitics.",2024-11-17,https://image.tmdb.org/t/p/w500/rxWtATtTdwx0ERQjQ7BtVOMyq5r.jpg
197150,Welcome to the Mushroom House,344.386,,2022-04-08,https://image.tmdb.org/t/p/w500/wPabr9Xo2DjQziZzCzxY07GNGN9.jpg
549,Law & Order,344.337,"In cases ripped from the headlines, police investigate serious and often deadly crimes, weighing the evidence and questioning the suspects until someone is taken into custody. The district attorney's office then builds a case to convict the perpetrator by proving the person guilty beyond a reasonable doubt. Working together, these expert teams navigate all sides of the complex criminal justice system to make New York a safer place.",1990-09-13,https://image.tmdb.org/t/p/w500/6vFL8S6Cci8s7SHWXz60xOisGBC.jpg
12536,Yu-Gi-Oh! GX,342.8,"Ten years after the Ceremonial Battle, a teenage boy named Judai Yuuki (Jaden Yuki) heads off in order to join the Duel Academia (Duel Academy) located on a remote island off the coast of Japan. There he meets his fellow students and gains a few friends, along with a few enemies. Judai is put into the lowest rank of Osiris Red (Slifer Red), but he continues to test his skills against the students and faculty to prove his worth as a Duelist and earn the respect of everyone around him.",2004-10-06,https://image.tmdb.org/t/p/w500/mS0uCfOFykWW5T5vG3zYFAgldTB.jpg
71790,S.W.A.T.,341.071,A locally born and bred S.W.A.T. lieutenant is torn between loyalty to the streets and duty to his fellow officers when he's tasked to run a highly-trained unit that's the last stop for solving crimes in Los Angeles.,2017-11-02,https://image.tmdb.org/t/p/w500/1rTEcLsnOoKXfDdGlbg0RHDvoaE.jpg
60735,The Flash,339.964,"After being struck by lightning, CSI investigator Barry Allen awakens from a nine-month coma to discover he has been  granted the gift of super speed.  Teaming up with S.T.A.R. Labs, Barry takes on the persona of The Flash, the Fastest  Man Alive, to protect his city.",2014-10-07,https://image.tmdb.org/t/p/w500/yZevl2vHQgmosfwUdVNzviIfaWS.jpg
1911,Bones,338.82,"Dr. Temperance Brennan and her colleagues at the Jeffersonian's Medico-Legal Lab assist Special Agent Seeley Booth with murder investigations when the remains are so badly decomposed, burned or destroyed that the standard identification methods are useless.",2005-09-13,https://image.tmdb.org/t/p/w500/eyTu5c8LniVciRZIOSHTvvkkgJa.jpg
10283,Archer,338.029,"Sterling Archer is the world's most daunting spy. He works for ISIS, a spy agency run by his mother. In between dealing with his boss and his co-workers - one of whom is his ex-girlfriend - Archer manages to annoy or seduce everyone that crosses his path. His antics are only excusable because at the end of the day, he still somehow always manages to thwart whatever crises was threatening mankind.",2009-09-17,https://image.tmdb.org/t/p/w500/o51NY5Zjgh7ridCu93dKOdKftVy.jpg
70625,Trace,337.947,,2007-09-03,https://image.tmdb.org/t/p/w500/p7srucCIMPIzKvvVgXQfxruQ4BA.jpg
235635,Like Water for Chocolate,337.485,"Tita de la Garza and Pedro Muzquiz are two souls in love who cannot be together due to deep-rooted family customs, which will force Tita to navigate with magical tints and flavors between the destiny dictated by her family and the fight for her love, while we accompany her in her greatest refuge: the kitchen.",2024-11-03,https://image.tmdb.org/t/p/w500/pXNcd4z8eBihLO9I7bIVoK4mtQt.jpg
65334,Miraculous: Tales of Ladybug & Cat Noir,337.445,"Marinette and Adrien, two Parisian teenagers, are entrusted with powerful jewels in order to transform into superheroes Ladybug and Cat Noir. But neither hero knows the other's true identity — or that they're classmates!",2015-10-19,https://image.tmdb.org/t/p/w500/3bxuTGk0c98gQkgBcKzC6HxQ8B6.jpg
2691,Two and a Half Men,335.751,A hedonistic jingle writer's free-wheeling life comes to an abrupt halt when his brother and 10-year-old nephew move into his beach-front house.,2003-09-22,https://image.tmdb.org/t/p/w500/xgfjxyV3g1S68opzuvG6G87muDp.jpg
126209,Julkalendern,331.704,An annual Swedish Christmas calendar television series.,1960-11-27,https://image.tmdb.org/t/p/w500/9xvNeHD7CCAMpbkb9Q2UFB9Dva0.jpg
30984,Bleach,329.969,"For as long as he can remember, Ichigo Kurosaki has been able to see ghosts. But when he meets Rukia, a Soul Reaper who battles evil spirits known as Hollows, he finds his life is changed forever. Now, with a newfound wealth of spiritual energy, Ichigo discovers his true calling: to protect the living and the dead from evil.",2004-10-05,https://image.tmdb.org/t/p/w500/2EewmxXe72ogD0EaWM8gqa0ccIw.jpg
118546,Clone High,327.339,"Twenty years after they were frozen, Abe, Cleo, JFK, and Joan suddenly find themselves thrust into the modern world, where they must navigate a fresh batch of historical clones, dramatic love triangles, and a formidable new foe.",2023-05-23,https://image.tmdb.org/t/p/w500/qM5L944slfDJUmc9v47ixxdeSUX.jpg
60572,Pokémon,326.66,"Join Ash accompanied by his partner Pikachu, as he travels through many regions, meets new friends and faces new challenges on his quest to become a Pokémon Master.",1997-04-01,https://image.tmdb.org/t/p/w500/rOuGm07PxBhEsK9TaGPRQVJQm1X.jpg
65733,Doraemon,325.375,"Robotic cat Doraemon is sent back in time from the 22nd century to protect 10-year-old Noby, a lazy and uncoordinated boy who is destined to have a tragic future. Doraemon can create secret gadgets from a pocket on his stomach, but they usually cause more bad than good because of Noby's propensity to misuse them.",2005-04-22,https://image.tmdb.org/t/p/w500/9ZN1P32SHviL3SV51qLivxycvcx.jpg
66732,Stranger Things,323.237,"When a young boy vanishes, a small town uncovers a mystery involving secret experiments, terrifying supernatural forces, and one strange little girl.",2016-07-15,https://image.tmdb.org/t/p/w500/uOOtwVbSr4QDjAGIifLDwpb2Pdl.jpg
261121,Desperate Mrs. Seonju,319.094,"Pi Seon Ju works as an interior designer in a small neighborhood. She is married to Jeon Nam Jin, who is an ambitious architect. Although Pi Seon Ju is devoted to her husband, her husband falls in love with Jin Sang A, who will become the successor of an architecture company. To further pursue his love and ambitions, Jeon Nam Jin demands a divorce from Pi Seon Ju. After their divorce, Pi Seon Ju decides to start her new life.

Meanwhile, architect Kim So U is married to Jin Sang A. Unlike Jin Sang A, he is satisfied with a stable situation rather than being fueled with ambition. Due to his wife's affair with Jeon Nam Jin, Kim So U gets divorced. After meeting Pi Seon Ju, Kim So U experiences a turning point in his life.",2024-11-18,https://image.tmdb.org/t/p/w500/wALnisqW9vGGJWH1GYUeCCWTcYd.jpg
18165,The Vampire Diaries,313.853,"The story of two vampire brothers obsessed with the same girl, who bears a striking resemblance to the beautiful but ruthless vampire they knew and loved in 1864.",2009-09-10,https://image.tmdb.org/t/p/w500/gbp4zM0FE0n23X4UFY5EBlacrog.jpg
240253,Conflict,313.4,"A small, Finnish seaside town is preparing to celebrate midsummer's eve. An unknown enemy arrives and takes the entire area hostage.",2024-11-30,https://image.tmdb.org/t/p/w500/gj4ojiqWFtS9cxGr7pU5l3YAwpk.jpg
94997,House of the Dragon,311.901,"The Targaryen dynasty is at the absolute apex of its power, with more than 15 dragons under their yoke. Most empires crumble from such heights. In the case of the Targaryens, their slow fall begins when King Viserys breaks with a century of tradition by naming his daughter Rhaenyra heir to the Iron Throne. But when Viserys later fathers a son, the court is shocked when Rhaenyra retains her status as his heir, and seeds of division sow friction across the realm.",2022-08-21,https://image.tmdb.org/t/p/w500/z2yahl2uefxDCl0nogcRBstwruJ.jpg
74016,The Resident,311.799,"A tough, brilliant senior resident guides an idealistic young doctor through his first day, pulling back the curtain on what really happens, both good and bad, in modern-day medicine.",2018-01-21,https://image.tmdb.org/t/p/w500/2IkYQJlT26yXef2iot7dhRtavSC.jpg
195648,CCTV Spring Festival Gala: Crosstalk and Sketch,310.822,,1983-02-12,https://image.tmdb.org/t/p/w500/i61poXdAvfQ454cLOV4qdrissOF.jpg
212907,La promesa,310.258,"In 1913 Spain, a woman gets a job at the palace of La Promesa as a reward for saving the marquesses' son - but nobody knows that she has her own plans, which involve avenging her mother's death and finding her missing brother.",2023-01-12,https://image.tmdb.org/t/p/w500/y656ZhHU2Hh3bmC5vBtMa2vKpUM.jpg
199332,Only You,308.219,,2010-10-30,https://image.tmdb.org/t/p/w500/mwE7mKwab8yIKjbJd302D7NaCgA.jpg
274136,Stardance XIII ...kolem dokola,307.09,,2024-10-14,https://image.tmdb.org/t/p/w500/iJPk8DSr2NVpfeFxembWxROqQNW.jpg
278412,24 stjerners julekalender,304.962,,2024-12-01,https://image.tmdb.org/t/p/w500/aSttB68V5pUSl6x4YqkTDuljllQ.jpg
2527,Emmerdale,304.571,"The lives of several families in the Yorkshire Dales revolve around a farm and the nearby village. With murders, affairs, lies, deceit, laughter and tears, it's all there in the village.",1972-10-16,https://image.tmdb.org/t/p/w500/ualtuRRNYa9Fj61wSuBVcuvaVDP.jpg
1431,CSI: Crime Scene Investigation,303.788,"A Las Vegas team of forensic investigators are trained to solve criminal cases by scouring the crime scene, collecting irrefutable evidence and finding the missing pieces that solve the mystery.",2000-10-06,https://image.tmdb.org/t/p/w500/i5hmoRjHNWady4AtAGICTUXknKH.jpg
34524,Teen Wolf,303.663,"Scott McCall, a high school student living in the town of Beacon Hills has his life drastically changed when he's bitten by a werewolf, becoming one himself. He must henceforth learn to balance his problematic new identity with his day-to-day teenage life. The following characters are instrumental to his struggle: Stiles, his best friend; Allison, his love interest who comes from a family of werewolf hunters; and Derek, a mysterious werewolf with a dark past. Throughout the series, he strives to keep his loved ones safe while maintaining normal relationships with them.",2011-06-05,https://image.tmdb.org/t/p/w500/fmlMmxSBgPEunHS5gjokIej048g.jpg
100757,Outer Banks,303.367,"A tight-knit group of teens unearths a long-buried secret, setting off a chain of illicit events that takes them on an adventure they'll never forget.",2020-04-15,https://image.tmdb.org/t/p/w500/ovDgO2LPfwdVRfvScAqo9aMiIW.jpg
273042,Our Honorary Photo Studio,302.758,,2024-11-04,https://image.tmdb.org/t/p/w500/ziHUUJpuuVc9qtN9I95SWpBC3ni.jpg
1398,The Sopranos,300.504,"The story of New Jersey-based Italian-American mobster Tony Soprano and the difficulties he faces as he tries to balance the conflicting requirements of his home life and the criminal organization he heads. Those difficulties are often highlighted through his ongoing professional relationship with psychiatrist Jennifer Melfi. The show features Tony's family members and Mafia associates in prominent roles and story arcs, most notably his wife Carmela and his cousin and protégé Christopher Moltisanti.",1999-01-10,https://image.tmdb.org/t/p/w500/rTc7ZXdroqjkKivFPvCPX0Ru7uw.jpg
1400,Seinfeld,298.645,A stand-up comedian and his three offbeat friends weather the pitfalls and payoffs of life in New York City in the '90s. It's a show about nothing.,1989-07-05,https://image.tmdb.org/t/p/w500/aCw8ONfyz3AhngVQa1E2Ss4KSUQ.jpg
275484,Die Ratgeber,297.111,,2019-04-01,
103108,MDR um 4,297.098,,2014-01-06,https://image.tmdb.org/t/p/w500/xoTOnCc50QJBwRZKlIaM92Q8vbh.jpg
57243,Doctor Who,296.58,"The Doctor is a Time Lord: a 900 year old alien with 2 hearts, part of a gifted civilization who mastered time travel. The Doctor saves planets for a living—more of a hobby actually, and the Doctor's very, very good at it.",2005-03-26,https://image.tmdb.org/t/p/w500/4edFyasCrkH4MKs6H4mHqlrxA6b.jpg
118453,Star of the Giants,296.547,"In 1969, at the press conference of Nagashima Shigeo who was joining a professional baseball team, Yomiurhi Kyojin, a ball was thrown at him by a boy. He was Hoshi Hyuma, and a thrown ball meant a letter of challenge. His father, Hoshi Ittetsu, had trained Huma since he had been very young to achieve his dream to make him a professional baseball player.",1968-03-30,https://image.tmdb.org/t/p/w500/3AvF4Z6v9ScbwCGDKKGfGSF5xU2.jpg
126280,Sex/Life,295.522,A woman's daring sexual past collides with her married-with-kids present when the bad-boy ex she can't stop fantasizing about crashes back into her life.,2021-06-25,https://image.tmdb.org/t/p/w500/kfcJl5e8CRWDU7e4vX6uNABPRbS.jpg
88713,We Are Who We Are,295.377,"Two American kids who live on a U.S. military base in Italy explore friendship, first love, identity, and all the messy exhilaration and anguish of being a teenager.",2020-09-14,https://image.tmdb.org/t/p/w500/33btSKKmjmc24hK9Vj1sRWQGfyh.jpg
32692,Blue Bloods,294.32,"A drama about a multi-generational family of cops dedicated to New York City law enforcement. Frank Reagan is the New York Police Commissioner and heads both the police force and the Reagan brood. He runs his department as diplomatically as he runs his family, even when dealing with the politics that plagued his unapologetically bold father, Henry, during his stint as Chief.",2010-09-24,https://image.tmdb.org/t/p/w500/q1WlrxnCvNhBjJ4N7V0JQXjnIBN.jpg
11843,No Hiding Place,294.231,"No Hiding Place is a British television series that was produced at Wembley Studios by Associated-Rediffusion for the ITV network between 16 September 1959 and 22 June 1967.

It was the sequel to the series Murder Bag and Crime Sheet, all starring Raymond Francis as Detective Superintendent, later Detective Chief Superintendent Tom Lockhart.",1959-09-16,https://image.tmdb.org/t/p/w500/mBWBngqaVMExKvj82eADPFW0AzT.jpg
1149,KO One,293.731,"Gifted with special powers, fighting skills and slick hair, the rowdy KO One navigates tough friendships and high school romance.",2005-11-26,https://image.tmdb.org/t/p/w500/tnrWCtRdYUiVMTTnAWvGLYXUj6I.jpg
58141,Farma,292.234,Serbian version of the reality series The Farm.,2011-07-24,https://image.tmdb.org/t/p/w500/xuscOJcoS9vMAKFgdiaDtypFg3y.jpg
75219,9-1-1,292.118,"Explore the high-pressure experiences of police officers, paramedics and firefighters who are thrust into the most frightening, shocking and heart-stopping situations. These emergency responders must try to balance saving those who are at their most vulnerable with solving the problems in their own lives.",2018-01-03,https://image.tmdb.org/t/p/w500/9dNWZPjFWdKo5Avr5JEEzLShLMZ.jpg
44006,Chicago Fire,291.902,"An edge-of-your-seat view into the lives of everyday heroes committed to one of America's noblest professions. For the firefighters, rescue squad and paramedics of Chicago Firehouse 51, no occupation is more stressful or dangerous, yet so rewarding and exhilarating. These courageous men and women are among the elite who forge headfirst into danger when everyone else is running the other way and whose actions make the difference between life and death.",2012-10-10,https://image.tmdb.org/t/p/w500/8IN24YxfyHMBhY1RNw7ctGUZ1JI.jpg
225920,Yonimo Kimyou na Monogatari Tokubetsuhen,290.944,,1990-10-04,https://image.tmdb.org/t/p/w500/kUMRtW0Db4K5LrjU8JhXwgCNqju.jpg
95603,Kuruluş Osman,288.928,"The life of Osman Bey, the son of Ertugrul Gazi and the founder of the Ottoman Empire.",2019-11-20,https://image.tmdb.org/t/p/w500/cU1KzcZl88bHv4cW43umPui1y0l.jpg
137726,Mao Xue Woof,288.83,"Mao Xue Woof is a scene-based reality show variety show with the relationship of original friends as the starting point. The program takes friendship as the link, and takes ""Mao Xue Woof's Home"" as the main shooting scene, telling the real and interesting stories of Mao Bu, Li Xueqin and their friends who meet here every week, tearing apart the status quo of daily life in laughter, showing the rich youth life and spiritual world of young people and recording the real growth. The program is broadcast every week all the year round, bringing companionship and emotional health healing to the hard-working young people in the city.",2021-11-01,https://image.tmdb.org/t/p/w500/kYBvEOxNhD3IfzapT6x1uPnTEFa.jpg
127532,Solo Leveling,288.062,"They say whatever doesn’t kill you makes you stronger, but that’s not the case for the world’s weakest hunter Sung Jinwoo. After being brutally slaughtered by monsters in a high-ranking dungeon, Jinwoo came back with the System, a program only he could see, that’s leveling him up in every way. Now, he’s inspired to discover the secrets behind his powers and the dungeon that spawned them.",2024-01-07,https://image.tmdb.org/t/p/w500/geCRueV3ElhRTr0xtJuEWJt6dJ1.jpg
87017,P-Valley,286.947,"Down deep in the Mississippi Delta, Trap music meets film noir in this kaleidoscopic story of a little-strip-club-that-could and the big characters who come through its doors—the hopeful, the lost, the broken, the ballers, the beautiful, and the damned.",2020-07-12,https://image.tmdb.org/t/p/w500/qAuKjGNbcwdhbpxSciak8BFjQ5F.jpg
1655,PBS News Hour,283.725,America's first and longest running hour-long nightly news broadcast known for its in-depth coverage of issues and current events.,1975-10-20,https://image.tmdb.org/t/p/w500/r8uKLWTegeog1lSbfHxDgnFRd9A.jpg
136651,Heroes of Sui and Tang Dynasties,282.817,"Heroes emerged in large numbers during the tumultuous and short-lived Sui to early Tang dynasty period. Most famous among them are Qin Qiong, Luo Cheng, Cheng Yao Jin, Shan Xiong Xin and Wei Chi Gong, known as the ""Five Tigers of Sui and Tang"", who would help Li Shi Min defeat rebels and rivals and pacify the land. The drama will start with the establishment of the Sui dynasty and end with Li Shi Min's ascension to the throne.",2012-12-03,https://image.tmdb.org/t/p/w500/xDWhzwXcp8dAn6unvA87nE7Dqh3.jpg
59941,The Tonight Show Starring Jimmy Fallon,282.631,"After Jay Leno's second retirement from the program, Jimmy Fallon stepped in as his permanent replacement. After 42 years in Los Angeles the program was brought back to New York.",2014-02-17,https://image.tmdb.org/t/p/w500/if7ECoH4xaYw5S8gomNIEmtwTxP.jpg
1338,Alarm for Cobra 11: The Motorway Police,281.987,"A long-running German television series about a two-man team of highway police, originally set in Berlin and later in North Rhine-Westphalia.",1996-03-12,https://image.tmdb.org/t/p/w500/mPhVxedeais0wtR38JIcsJdqH5Z.jpg
108978,Reacher,281.852,"Jack Reacher, a veteran military police investigator, has just recently entered civilian life. Reacher is a drifter, carrying no phone and the barest of essentials as he travels the country and explores the nation he once served.",2022-02-03,https://image.tmdb.org/t/p/w500/jFuH0md41x5mB4qj5344mSmtHrO.jpg
217772,GG Bond,279.494,,2006-07-01,https://image.tmdb.org/t/p/w500/9XC8xxZU01ZMtilejudKuJtPHbV.jpg
57532,PAW Patrol,279.175,PAW Patrol is a CG action-adventure for old children and preschool series starring a pack of six heroic puppies led by a tech-savvy 10-year-old boy named Ryder.,2013-08-12,https://image.tmdb.org/t/p/w500/8HXkgUBO5OF8ZK9XbY69RM4S5rv.jpg
56570,Outlander,278.388,"The story of Claire Randall, a married combat nurse from 1945 who is mysteriously swept back in time to 1743, where she is immediately thrown into an unknown world where her life is threatened. When she is forced to marry Jamie, a chivalrous and romantic young Scottish warrior, a passionate affair is ignited that tears Claire's heart between two vastly different men in two irreconcilable lives.",2014-08-09,https://image.tmdb.org/t/p/w500/oftZNfyTVNU7IfOqoGLoT8MGvNs.jpg
12971,Dragon Ball Z,277.713,"The adventures of Earth's martial arts defender, Son Goku, continue with a new family and the revelation of his alien origins. Now Goku and his allies must defend the planet from an onslaught of new extraterrestrial enemies.",1989-04-26,https://image.tmdb.org/t/p/w500/6VKOfL6ihwTiB5Vibq6QTfzhxA6.jpg
85552,Euphoria,275.604,"A group of high school students navigate love and friendships in a world of drugs, sex, trauma, and social media.",2019-06-16,https://image.tmdb.org/t/p/w500/3Q0hd3heuWwDWpwcDkhQOA6TYWI.jpg
128854,사랑은 이런거야,165.374,It is a drama that gets the sympathy of an unspecified number of people and satisfies their needs.,2001-10-29,
71789,SEAL Team,286.875,"Military drama following the professional and personal lives of the most elite unit of Navy SEALs as they train, plan and execute the most dangerous, high stakes missions our country can ask of them.",2017-09-27,https://image.tmdb.org/t/p/w500/6iSnec83UEMgLOXAtGYwaVNHLjR.jpg
128847,Yellow Handkerchief,162.479,"Sang-min wants success in life, and in pursuit of success, he abandons his ten-year relationship with Ja-yeong to marry his boss’ daughter, Min-ju. Ja-yeong finds herself pregnant and raising a child alone. When Sang-min finds out, the battle over custody of child begins. This drama became a number one hit and captured more than 30% of viewers during its broadcast while unraveling the mysteries of waiting, forgiveness and above all - the value of love.",2003-02-03,https://image.tmdb.org/t/p/w500/77iV9OM75b1A32FdvXSgeNSGQYR.jpg
100064,Love Naggers,162.383,"From the quirky to the scandalous, any relationship is fair game for a panel of love experts who comb over text messages and revel in reenactments.",2018-01-13,https://image.tmdb.org/t/p/w500/5CxwFNv9YVk1YyAkzbyXAMplbfX.jpg
4604,Smallville,299.385,The origins of the world’s greatest hero–from Krypton refugee Kal-el’s arrival on Earth through his tumultuous teen years to Clark Kent’s final steps toward embracing his destiny as the Man of Steel.,2001-10-16,https://image.tmdb.org/t/p/w500/dc9a9n4g9Ibs485t5eBtyNG0mcr.jpg
255868,Dream Productions,236.155,"Riley is growing up and when her memories need some extra processing, Joy and the rest of the Core Emotions send them to Dream Productions. Acclaimed director Paula Persimmon faces a nightmare of her own: trying to create the next hit dream after being paired up with Xeni, a smug daydream director looking to step up into the big leagues of night dreams.",2024-12-11,https://image.tmdb.org/t/p/w500/j9jz5wZlQoq65YuYPNauB72uvFJ.jpg
60622,Fargo,275.644,"A close-knit anthology series dealing with stories involving malice, violence and murder based in and around Minnesota.",2014-04-15,https://image.tmdb.org/t/p/w500/6U9CPeD8obHzweikFhiLhpc7YBT.jpg
64356,The Return of Superman,273.157,"An up-close look at celebrity dads who have to take care of their kids for the next 48 hours without any help. Will it be a dad-tastrophe, or can they finish their wives' to-do lists while having fun with their kids?",2013-11-03,https://image.tmdb.org/t/p/w500/qjBx2RCnyyBPgu9qBV7j3UiXjeo.jpg
211288,Tracker,189.093,"Lone-wolf survivalist Colter Shaw roams the country as a “reward seeker,” using his expert tracking skills to help private citizens and law enforcement solve all manner of mysteries while contending with his own fractured family.",2024-02-11,https://image.tmdb.org/t/p/w500/nU9zGHC1GRHVoTSTaKiRy1RljNd.jpg
19530,Pili,255.74,"Pili is a puppet show from Taiwan. It is made by Pili International Multimedia. The TV series started in 1985, and it still continues today. It is one of the most popular TV shows in Taiwan. Pili puppet show is performed by many kinds of puppets, some of them are cool, some are intelligent, and some are funny. Unlike traditional puppet shows, Pili puppet show uses state-of-the-art animation to help present its fighting art. The delicate design of the appearance and characteristics of each puppet has made Pili puppet show a well-known entertainment in Taiwan.",1988-06-01,https://image.tmdb.org/t/p/w500/c6CKmPSXO8omy0eHQX7TcEtz72i.jpg
132791,SUPERKID,157.669,"Mitsuo encountered Superman, an alien who is a part of a federation that tries to maintain peace in the galaxy. He then received a helmet (that also serves as a mask) that gives superhuman strength, a cape that enables the wearer to fly, and a badge that allows him to breathe underwater and communicate with his fellow comrades whom he met soon after he utilized these gifts. Superman made it clear to all Permans that their identity must be kept a secret or their brain will be destroyed should it ever be revealed and they are given a special doppelganger robot that can replace them while they are away to achieve this feat, although it is not entirely foolproof nor is it free from potential problems. These equipments then allowed them to be young Permans who try to maintain peace and help the people who are in need.",1983-04-04,https://image.tmdb.org/t/p/w500/lCGbsqKiOvRICllC4AgZ67zjrSL.jpg
121135,Be My Dream Family,157.438,"The story of the series revolves around two families Geumgane and Hangane from different cultural backgrounds. They meet when their parents remarry in the twilight of life, and they become one family. The series follows the conflict, understanding and harmony of the extended family, showing meaning of a true family.",2021-03-29,https://image.tmdb.org/t/p/w500/xlPTAodB4QF7wNAguRUOSu2ui2t.jpg
