TVShowId,Title,Popularity,Overview,ReleaseDate,PosterPath
206559,Binnelanders,2455.284,"A South African Afrikaans soap opera. It is set in and around the fictional private hospital, Binneland Kliniek, in Pretoria, and the storyline follows the trials, trauma and tribulations of the staff and patients of the hospital.",2005-10-13,https://image.tmdb.org/t/p/w500/3bzECfllho8PphdYujLUIuhncJD.jpg
258463,Brocade Odyssey,2358.865,"Ji Yingying, a spirited woman from the Shu brocade, strives to restore her family’s honor and rebuild their legacy. Facing powerful rivals and the looming threat of Nanzhao Kingdom, she joins forces with Yang Jinglan to revive the Shu brocade industry and safeguard its artisans.",2024-11-30,https://image.tmdb.org/t/p/w500/6TobR12xuAxyuN8BL0Yf08ZfFly.jpg
18770,Gran Hermano,2078.686,"Gran Hermano is a reality television series broadcast in Spain on Telecinco and La Siete produced by Endemol. It is part of the Big Brother franchise first developed in the Netherlands. As of February 2012, 19 editions of the show have aired.",2000-04-23,https://image.tmdb.org/t/p/w500/gQ0Emh2LT047Fip2HWye3NkrkQB.jpg
262697,Nissesvingen,2012.222,,2024-12-01,https://image.tmdb.org/t/p/w500/2ZIJRRbKNyMr7W4Imy6jjv3E6bD.jpg
239270,Asbjørns julekalender,1846.127,,2023-12-01,https://image.tmdb.org/t/p/w500/lG3usDELM3VixdqTGWNdjE8QVms.jpg
214756,24-stjerners julekalender,1784.758,,2022-12-01,https://image.tmdb.org/t/p/w500/txuVmmwkO1KM3Ml6dQfsBo7ptdQ.jpg
112470,Ici tout commence,1741.739,"This television drama series is centered around the prestigious culinary school of renowned chef Auguste Armand. The show follows the lives of students and staff as they navigate the challenges and pressures of the culinary world—delving into their personal and professional lives, revealing secrets, rivalries, and complex relationships.",2020-11-02,https://image.tmdb.org/t/p/w500/v7nXPo2zdaIOfeIaERiOuTEt89N.jpg
1416,Grey's Anatomy,1733.158,Follows the personal and professional lives of a group of doctors at Seattle’s Grey Sloan Memorial Hospital.,2005-03-27,https://image.tmdb.org/t/p/w500/7jEVqXC14bhfAzSPgr896dMdDv6.jpg
91759,Come Home Love: Lo and Behold,1713.543,"Hung Sue Gan starting from the bottom, established his own logistics company, which is now running smoothly. His only concern now are his three daughters. His eldest daughter has immigrated overseas. His second daughter Hung Yeuk Shui has reached the marriageable age, but has no hopes for marriage anytime soon. She is constantly bickering with her younger sister Hung Sum Yue, who is an honour student, over trivial matters, causing their father to not know whether to laugh or cry. Hung Sue Yan, Hung Sue Gan's brother, moves in with the family, temporarily ending his life as a nomadic photographer. He joins Hung Yeuk Shui's company and encounters Ko Pak Fei, the director of an online shop. The two appear to be former lovers, making for lots of laughter. Since Hung Sue Yan moved in, a series of strange events have occurred in the family. Upon investigation, the source is traced to Lung Ging Fung, a promising young man who is the son of department store mogul Lung Gam Wai.",2017-02-06,https://image.tmdb.org/t/p/w500/lgD4j9gUGmMckZpWWRJjorWqGVT.jpg
247885,Papás por Conveniencia,1697.759,"Tino, a single father who faces great challenges in raising his two children, finds out one day that he is also the father of two rebellious teenagers, children of Aidé, a former high school classmate who has become an important businesswoman. For Tino, this news becomes an opportunity to take on the role of father of the children he never knew he had. Thus, he begins to work at Aidé's company, but everything gets complicated when Tino and his family move into Aidé's house to integrate into her new life. The house becomes a battlefield, both of their children have problems adapting, and love resurfaces between Tino and Aidé and a torrid romance begins. But building this new life for Aidé, Tino and their children will not be easy; they will have to face serious obstacles, always supported by the strength of their love and that of their children.",2024-10-21,https://image.tmdb.org/t/p/w500/y7yIu9PKx2WTphhYgbBq9C1RNzV.jpg
244919,Snow Dreams,1626.763,"The snow is mysteriously missing from ski resort Gavmofjäll, leading 14-year old sámi girl Ristin and her little sister Aila on a quest deep into the ancient secrets of the mountain to save their family from catastrophe.",2024-12-01,https://image.tmdb.org/t/p/w500/mF2KuN917JQmRYJTI74s0hGlunr.jpg
113779,Hallo Hessen,1576.562,,2012-01-30,https://image.tmdb.org/t/p/w500/zRGme9GL0H5RmwzxKYzoXafcRDp.jpg
249010,Kelders van Geheime,1575.808,"Kelders van Geheime (Cellars of Secrets) is a South African, Afrikaans-language telenovela based on the wheeling's and dealings of the community that lives on Soebatskloof (a wine farm in the Cape). The series focuses on three families: the Abrahams, Syster and Marais households. These families will have to stand together, agree (or agree to disagree), and work together to earn their bread and butter – and a glass of wine.",2024-05-06,https://image.tmdb.org/t/p/w500/vf1I0G5jICTstI1EXxb9Oqq80TU.jpg
251691,Autumn of the Heart,1564.578,"A devastating car accident unearths a long-buried secret that turns wealthy businessman Rashid and hardworking Nahla's life around; fifteen years ago, their daughters were switched at birth.",2024-10-27,https://image.tmdb.org/t/p/w500/8uDmIxjBx90y5OCwJDBADtQzxb7.jpg
248890,Ready Steady Cook South Africa,1564.216,"In Ready Steady Cook, two teams - a Red Tomato and a Green Pepper - compete in a Red Kitchen and a Green Kitchen, together with a South African chef on each side and paired with enthusiastic home cooks, as they are challenged creatively with a mystery bag of ingredients in a 20-minute cook-off.",2024-03-18,https://image.tmdb.org/t/p/w500/30xX4IMbgnMbQwo76xM4BOSokZO.jpg
257048,Garota do Momento,1515.672,,2024-11-04,https://image.tmdb.org/t/p/w500/jFSkjQSZ5Td52igalpoTQRuHtk.jpg
257064,Volta por Cima,1447.166,,2024-09-30,https://image.tmdb.org/t/p/w500/nyN8R0P1Hqwq7ksJz4O2BIAUd4W.jpg
73586,Yellowstone,1363.76,"Follow the violent world of the Dutton family, who controls the largest contiguous ranch in the United States. Led by their patriarch John Dutton, the family defends their property against constant attack by land developers, an Indian reservation, and America’s first National Park.",2018-06-20,https://image.tmdb.org/t/p/w500/s4QRRYc1V2e68Qy9Wel9MI8fhRP.jpg
13008,TMZ,1361.154,"Based on the popular gossip website, this entertainment newsmagazine delivers daily updates on Hollywood's rich, beautiful and screwed-up. The program often shows highlights of the day's staff meeting during which reporters pitch ideas for stories to air that day.",2007-09-10,https://image.tmdb.org/t/p/w500/ifFpUG51DJaQxwnZ35VwoGRFGGv.jpg
252373,A Promessa,1343.527,,2024-06-18,https://image.tmdb.org/t/p/w500/uptgxt2apx5wwWItQzqL0HwhjZC.jpg
112261,Abendschau,1280.034,,2000-05-04,
222766,The Day of the Jackal,1219.44,"An unrivalled and highly elusive lone assassin, the Jackal, makes his living carrying out hits for the highest fee. But following his latest kill, he meets his match in a tenacious British intelligence officer who starts to track down the Jackal in a thrilling cat-and-mouse chase across Europe, leaving destruction in its wake.",2024-11-07,https://image.tmdb.org/t/p/w500/wx1NFvapK10CvEppm9y8333uZWG.jpg
36361,Ulice,1210.5,"Ulice is a Czech soap opera produced and broadcast by Nova. In the Czech language Ulice means street.

The show describes the lives of the Farský, Jordán, Boháč, Nikl, and Liška families and many other people that live in Prague. Their daily battle against real problems of living in a modern world like divorce, love, betrayal and illness or disease. Ulice often shows crime.",2005-09-05,https://image.tmdb.org/t/p/w500/gFEHva8Csx18hMGJJZ6gi4sFSKR.jpg
68822,Time travels,1199.888,"A teenage girl wish for her parents to get back together, when suddenly she meets a time traveling guy from the future. Together they try to change both the past and the feature - with small bumps on their way.",2014-12-01,https://image.tmdb.org/t/p/w500/uP5zHXeXsm1pLdnTPinNC6nvbsN.jpg
256121,Lavender Fields,1185.334,"Jasmin loved her idyllic life in her mountain town, but a brush with a criminal empire took it all away. Now she's out for revenge with a new identity.",2024-09-02,https://image.tmdb.org/t/p/w500/lphvsr062SlxWM6XegsV2dLGaiE.jpg
1622,Supernatural,1168.275,"When they were boys, Sam and Dean Winchester lost their mother to a mysterious and demonic supernatural force. Subsequently, their father raised them to be soldiers. He taught them about the paranormal evil that lives in the dark corners and on the back roads of America ... and he taught them how to kill it. Now, the Winchester brothers crisscross the country in their '67 Chevy Impala, battling every kind of supernatural threat they encounter along the way. ",2005-09-13,https://image.tmdb.org/t/p/w500/KoYWXbnYuS3b0GyQPkbuexlVK9.jpg
235484,Suidooster,1081.417,"Suidooster is a South African television soap opera produced by Suidooster Films which revolves around a matriarch, her family, friends and the people of Suidooster, a small shopping and business centre in the fictional Cape Town suburb of Ruiterbosch.",2015-11-16,https://image.tmdb.org/t/p/w500/naCgSiacvV685kait6fBvhVhdce.jpg
154828,Vandaag Inside,1074.419,,2022-01-10,https://image.tmdb.org/t/p/w500/xEFfIcHzlxiYw8e6hXRCqskSKsG.jpg
242722,Shrimad Ramayan,1050.202,"Shrimad Ramayan is an ambitious television series that brings to life the timeless epic, the Ramayan, with a deep commitment to authenticity, cultural reverence and a contemporary sensibility.",2024-01-22,https://image.tmdb.org/t/p/w500/aCDK83ykQYnQGFOTfiLjnoqXv1b.jpg
60780,Four in a Bed,1036.507,Four pairs of B&B owners from across Britain take it in turns as hosts to decide which of their establishments provides the best value for money.,2010-11-22,https://image.tmdb.org/t/p/w500/nFzW9V9rjKQcsunNrjw1yPc2zT8.jpg
125988,Silo,982.956,"In a ruined and toxic future, thousands live in a giant silo deep underground. After its sheriff breaks a cardinal rule and residents die mysteriously, engineer Juliette starts to uncover shocking secrets and the truth about the silo.",2023-05-04,https://image.tmdb.org/t/p/w500/tlliQuCupf8fpTH7RAor3aKMGy.jpg
235493,De Bondgenoten,960.554,,2023-10-22,https://image.tmdb.org/t/p/w500/wsipinibYxrZhpkQ6MKxIMgL0hv.jpg
261033,The Agent,951.033,"A police captain infiltrates a notorious gang, only to find himself going deeper down the rabbit hole.",2024-08-18,https://image.tmdb.org/t/p/w500/qUtgaa43jTELs0Tdw55aIukt9yn.jpg
72879,Tomorrow Is Ours,932.54,"The story revolves around the people of Sète, France. Their lives are punctuated by family rivalries, romance and scenes from daily life, but also by plots involving police investigations, secrets and betrayals.",2017-07-17,https://image.tmdb.org/t/p/w500/zMWldNZF0wS3L5XkDVFHxYhclcL.jpg
45789,Sturm der Liebe,916.92,"These are the stories of relationships taking place in the fictional five-star hotel Fürstenhof, located in Feldkirchen-Westerham near Rosenheim with the plot revolving around members of the family room area, the hotel owners, and employees.",2005-09-26,https://image.tmdb.org/t/p/w500/9oZjOh3Va3FsiLGouhSogFsBX9G.jpg
260695,sensitive chord,913.713,"In a social dramatic context, the events of the series revolve around the issue of marital infidelity and the secrets of the human soul through three women (a doctor, a lawyer, and an employee in one of the departments), where the pace of events escalates due to the disputes between the lawyer and her husband, an interior designer, especially after she accused him of betrayal, with the intertwined relationships between all parties.",2024-10-27,https://image.tmdb.org/t/p/w500/hHoBvznjHhGqPKNkRnqb9zUq8s6.jpg
276336,Secret Number,910.412,"The story revolves around a meeting, a bank employee, who finds herself caught up in a dangerous fraud after being implicated by artificial intelligence techniques. How will she face the unknown fate?",2024-11-09,https://image.tmdb.org/t/p/w500/546DFmaLuA408xyfVb8goQSP5bK.jpg
124364,FROM,898.106,"Unravel the mystery of a nightmarish town in middle America that traps all those who enter. As the unwilling residents fight to keep a sense of normalcy and search for a way out, they must also survive the threats of the surrounding forest – including the terrifying creatures that come out when the sun goes down.",2022-02-20,https://image.tmdb.org/t/p/w500/cjXLrg4R7FRPFafvuQ3SSznQOd9.jpg
261791,Omusubi,880.229,"A Heisei youth graffiti drama, in which the heroine Yoneda Yui (Hashimoto Kanna), born in the first year of the Heisei era, connects people's hearts to the future as a nutritionist. Always cherishing her individuality, she sometimes struggles, but powerfully and joyfully pushes through the turbulent Heisei and Reiwa eras.",2024-09-30,https://image.tmdb.org/t/p/w500/tK855sva67LB7opmPW4JHn1c5VI.jpg
262969,Return to Las Sabinas,857.2,"Gracia and Paloma return to Las Sabinas to look after their father, Emilio. Gracia reunites with her childhood sweetheart, Miguel, who is now engaged to Esther. Paloma takes over the family's land and clashes with landowner Paca Utrera, who shares a terrible secret with Emilio and has a nefarious plan for the village. Young Óscar is found dead under strange circumstances. Manuela must investigate the murder with the help of Óscar's brother, Álex, who is a priest.",2024-10-11,https://image.tmdb.org/t/p/w500/xMMH3r8gJtWVe1841BtHGjDooUm.jpg
262831,My Merry Marriage,853.782,"A delightful family drama that asks the true meaning of 'happiness' by showing various aspects of marriage such as divorce, remarriage, and single life, and brings about empathy and laughter from all generations.

Maeng Gong Hee is a contract designer at Jayce Fashion. Having inherited her strong mother's spirit and her former detective father's athletic ability, she is a rare wild woman these days who has the guts to survive even if she were to be stranded on a deserted island.

Gu Dan Soo is the grandson of Jayce Fashion Chairman Hwang Ik Seon and born to a wealthy father and a poor mother. Dan Soo, who was living as a free spirit in a foreign country, comes to Korea according to his grandmother's plan to make a successor to the chairman out of him and he reunites with childhood friend Maeng Gong Hee once again.",2024-10-07,https://image.tmdb.org/t/p/w500/lp7uJ6tZ9k8m7kW75hIAOUafXr4.jpg
278181,Hessenschau,836.816,,1961-07-30,
236994,Dragon Ball DAIMA,826.025,"Mysteriously transformed into mini versions of themselves, Goku and his friends travel to the Demon Realm to uncover the truth and find a cure.",2024-10-11,https://image.tmdb.org/t/p/w500/cIDPZMGsiVHkHA6HPJmEmGcgyyw.jpg
4614,NCIS,817.443,"From murder and espionage to terrorism and stolen submarines, a team of special agents investigates any crime that has a shred of evidence connected to Navy and Marine Corps personnel, regardless of rank or position.",2003-09-23,https://image.tmdb.org/t/p/w500/mBcu8d6x6zB1el3MPNl7cZQEQ31.jpg
270792,Die Spreewaldklinik,796.047,,2024-08-29,https://image.tmdb.org/t/p/w500/9M5b0dSMIvtIntBCb7MCv9JTwEc.jpg
2912,Jeopardy!,749.958,"America's favorite quiz show where contestants are presented with general knowledge clues in the form of answers, and must phrase their responses in question form.",1984-09-10,https://image.tmdb.org/t/p/w500/11rWvQOEZBouD7wet0sWHwu7NDs.jpg
240411,Dan Da Dan,746.239,"In a bet to prove whether ghosts or aliens exist, two high schoolers face terrifying paranormal threats, gain superpowers and maybe even fall in love?!",2024-10-04,https://image.tmdb.org/t/p/w500/6qfZAOEUFIrbUH3JvePclx1nXzz.jpg
242931,Pulang Araw,745.879,"Red Sun is a family drama that tells stories of courage, sacrifice, and hardships that every Filipino family has. These stories were inspired by the tales of the unsung heroes who defied the odds of World War II and the Japanese occupation of the Philippines.",2024-07-29,https://image.tmdb.org/t/p/w500/2zbaRzgieKiHYkTGztQUzrAYbgb.jpg
243117,"Plus belle la vie, encore plus belle",736.324,,2024-01-08,https://image.tmdb.org/t/p/w500/5js5JCtxfiYF2MdNn0zGyCwyg8L.jpg
81329,Chronicles of the Sun,732.763,Claire is surprised when she gets arrested for the murder of her childhood friend after she returns to Montpellier.,2018-08-27,https://image.tmdb.org/t/p/w500/t6jVlbPMtZOJoAOfeoR4yQmnjXM.jpg
156899,Houkago,731.0,"Azusa Akiyama is top of her class, only daughter of a supermarket manager in Los Angeles.  Kouhei Takamoto is her classmate, a rough and tumble guitarist for the band Cherry Boys.  One day after school, they crash into each other, and fallen electrical lines cause them to switch bodies.",1992-10-15,https://image.tmdb.org/t/p/w500/5hhJXYEjgHTzGw3CWGaGhG7tAXr.jpg
239526,Sueños de libertad,720.121,,2024-02-25,https://image.tmdb.org/t/p/w500/95RVeMWMvk97PBW0msryIJC32XD.jpg
274717,MDR aktuell,712.596,,2021-02-04,
273825,Amor amargo,710.874,,2024-11-04,https://image.tmdb.org/t/p/w500/u8TkzDfknYHbx0NEsD8TSzw3M5f.jpg
273911,La mujer de mi vida,710.311,"The series revolves around Ricardo Oribe (Iván Sánchez), a physically unattractive but successful businessman, dedicated to his family and in love with his beautiful wife Daniela (Angélica Celaya), a young aspiring actress. Ricardo's life takes a turn when his best friend Emilio (Mauricio Islas) betrays him and tries to kill him in order to take over his company and the family he never had. Despite being presumed dead by his family and friends, Ricardo is still alive, but suffering from amnesia. After a course of 15 years, Ricardo goes through several physical changes and recovers his memory.",2024-10-08,https://image.tmdb.org/t/p/w500/4Qksv87C57O0IWA8sT2KwxZ4fXh.jpg
261579,Secret Level,702.475,"Adult animated series of original short stories which are set within the worlds of beloved video games. Each episode serves as a gateway to a new adventure, unlocking exciting worlds from beloved gaming classics and highly anticipated new titles.",2024-12-10,https://image.tmdb.org/t/p/w500/vjdj1kg3UpHYWa9GqNn8psRUPan.jpg
131041,BLUE LOCK,697.387,"After a disastrous defeat at the 2018 World Cup, Japan's team struggles to regroup. But what's missing? An absolute Ace Striker, who can guide them to the win. The Japan Football Union is hell-bent on creating a striker who hungers for goals and thirsts for victory, and who can be the decisive instrument in turning around a losing match...and to do so, they've gathered 300 of Japan's best and brightest youth players. Who will emerge to lead the team...and will they be able to out-muscle and out-ego everyone who stands in their way?",2022-10-09,https://image.tmdb.org/t/p/w500/fT9W86KFA9Khy2hIbkfClI8IYDH.jpg
2288,Prison Break,685.494,"Due to a political conspiracy, an innocent man is sent to death row and his only hope is his brother, who makes it his mission to deliberately get himself sent to the same prison in order to break the both of them out, from the inside out.",2005-08-29,https://image.tmdb.org/t/p/w500/5E1BhkCgjLBlqx557Z5yzcN0i88.jpg
113962,Lioness,682.875,"Cruz Manuelos, a rough-around-the-edges but passionate young Marine, is recruited to join the CIA's Lioness Engagement Team to help bring down a terrorist organization from within. Joe, the station chief of the Lioness program, is tasked with training, managing and leading her female undercover operatives.",2023-07-23,https://image.tmdb.org/t/p/w500/ajaXSmdAlYYhnvx1EIsvpfN949y.jpg
242099,Lady of the sea,672.799,"On her birthday, Joana's joy turns to despair when her abusive husband discovers her pregnancy and attempts to harm her. Fleeing the city, she finds refuge on a boat with criminals, but realizing the danger, she sees land beyond so leaps into the water and swims to Terceira Island, leaving her life behind. Exhausted on the shore, she encounters Chico, a lost child, during a religious ceremony. Joana arrives with the child, inadvertently becoming mistaken for a saint 'Our Lady of the Sea', revered by the island's faithful.",2024-02-05,https://image.tmdb.org/t/p/w500/wy4tkwuoWMGEa5Wi8dCvLVuxBzt.jpg
1399,Game of Thrones,642.828,"Seven noble families fight for control of the mythical land of Westeros. Friction between the houses leads to full-scale war. All while a very ancient evil awakens in the farthest north. Amidst the war, a neglected military order of misfits, the Night's Watch, is all that stands between the realms of men and icy horrors beyond.",2011-04-17,https://image.tmdb.org/t/p/w500/1XS1oqL89opfnbLl8WnZY1O1uJx.jpg
2734,Law & Order: Special Victims Unit,705.865,"In the criminal justice system, sexually-based offenses are considered especially heinous. In New York City, the dedicated detectives who investigate these vicious felonies are members of an elite squad known as the Special Victims Unit. These are their stories.",1999-09-20,https://image.tmdb.org/t/p/w500/abWOCrIo7bbAORxcQyOFNJdnnmR.jpg
275464,Escupiré sobre sus tumbas,658.025,"The telenovela follows Brian O'Connor, who wants to avenge the death of his brother Sonny, who was found dead, apparently by suicide, on the Caribbean Coast. Brian will go there in the guise of Vinicio Gallo, a renowned ship captain, to uncover the truth, no matter who he has to go through, even if it is the Obregón Artelli family, one of the most powerful and prestigious families on the Caribbean Coast, whose members are suspects.",2024-10-28,https://image.tmdb.org/t/p/w500/nssLYA0PvK3RVfBh2cV4JXyWXRN.jpg
205582,Brisant,921.108,,1994-01-03,https://image.tmdb.org/t/p/w500/mzxp9rTCepnSe8wl0GzZLave9bd.jpg
2224,The Daily Show,390.127,"The World's Fakest News Team tackle the biggest stories in news, politics and pop culture.",1996-07-22,https://image.tmdb.org/t/p/w500/ixcfyK7it6FjRM36Te4OdblAq4X.jpg
90228,Dune: Prophecy,831.934,"Ten thousand years before the ascension of Paul Atreides, sisters Valya and Tula Harkonnen establish the fabled sect and female order that would become known as the Bene Gesserit to control the future of humankind.",2024-11-17,https://image.tmdb.org/t/p/w500/5B8Cxz8ZZXp3w2WmmdKTXpkS24e.jpg
12409,Star Academy,626.326,"Star Academy is a French reality television show produced by the Dutch company Endemol. It consists of a contest of young singers. It spawned an equally successful show in Quebec called Star Académie. It is broadcast on TF1. At the end of each season, selected contestants would go on tour around France, Morocco, Switzerland, Belgium, Tunisia, and other French-speaking countries.",2001-10-20,https://image.tmdb.org/t/p/w500/26qS8VmB7PgtkkBuA0J20nmTish.jpg
79744,The Rookie,608.734,"Starting over isn’t easy, especially for small-town guy John Nolan who, after a life-altering incident, is pursuing his dream of being an LAPD officer. As the force’s oldest rookie, he’s met with skepticism from some higher-ups who see him as just a walking midlife crisis.",2018-10-16,https://image.tmdb.org/t/p/w500/wbeqBUFydztHDQ4h7dZqnknh5HE.jpg
4682,Strictly Come Dancing: It Takes Two,362.983,"The companion show to the popular BBC One programme Strictly Come Dancing which features interviews and training footage of the couples competing in the main Saturday night show, opinions from the judges on the previous Saturday show and the training footage for the next, and interviews with celebrities who have been watching the show.",2004-10-25,https://image.tmdb.org/t/p/w500/1UOKLsJ3bopZHg6ntRfmO4C5Gcm.jpg
456,The Simpsons,575.425,"Set in Springfield, the average American town, the show focuses on the antics and everyday adventures of the Simpson family; Homer, Marge, Bart, Lisa and Maggie, as well as a virtual cast of thousands. Since the beginning, the series has been a pop culture icon, attracting hundreds of celebrities to guest star. The show has also made name for itself in its fearless satirical take on politics, media and American life in general.",1989-12-17,https://image.tmdb.org/t/p/w500/vHqeLzYl3dEAutojCO26g0LIkom.jpg
1419,Castle,366.939,"After a serial killer imitates the plots of his novels, successful mystery novelist Richard ""Rick"" Castle receives permission from the Mayor of New York City to tag along with an NYPD homicide investigation team for research purposes.",2009-03-09,https://image.tmdb.org/t/p/w500/diXBeMzvfJb2iJg3G0kCUaMCzEc.jpg
1405,Dexter,614.338,"Dexter Morgan, a blood spatter pattern analyst for the Miami Metro Police also leads a secret life as a serial killer, hunting down criminals who have slipped through the cracks of justice.",2006-10-01,https://image.tmdb.org/t/p/w500/q8dWfc4JwQuv3HayIZeO84jAXED.jpg
1900,LIVE with Kelly and Mark,768.825,"A morning talk show with A-list celebrity guests, top-notch performances and one-of-a-kind segments that are unrivaled on daytime television, plus spontaneous, hilarious and unpredictable talk.",1988-09-05,https://image.tmdb.org/t/p/w500/l5y8egG27p2fSTyq8s21SQMmQLy.jpg
1054,The Young and the Restless,343.59,"The rivalries, romances, hopes and fears of the residents of the fictional Midwestern metropolis, Genoa City. The lives and loves of a wide variety of characters mingle through the generations, dominated by the Newman, Abbott, Baldwin and Winters families.",1973-03-26,https://image.tmdb.org/t/p/w500/4rdJWBQQV1Iqve8kYq8wdfcvUKo.jpg
94722,Tagesschau,796.496,"German daily news program, the oldest still existing program on German television.",1952-12-26,https://image.tmdb.org/t/p/w500/7dFZJ2ZJJdcmkp05B9NWlqTJ5tq.jpg
