TVShowId,Title,Popularity,Overview,ReleaseDate,PosterPath
154770,Hello Saturday,336.519,"""Hello, Saturday"" is the rebranding of popular Chinese show ""Happy Camp"", hosted by He Jiong and with a fixed group of regular celebrity members.

The program showcases the talent of various stars as well as social topics through creative and diverse content and games. It aims to spread positive energy whilst keeping up with the current trends and leading youth culture.",2022-01-01,https://image.tmdb.org/t/p/w500/4Se9ZzVVtfqBUohW2pxC1e7tM3M.jpg
1396,Breaking Bad,599.47,"Walter White, a New Mexico chemistry teacher, is diagnosed with Stage III cancer and given a prognosis of only two years left to live. He becomes filled with a sense of fearlessness and an unrelenting desire to secure his family's financial future at any cost as he enters the dangerous world of drugs and crime.",2008-01-20,https://image.tmdb.org/t/p/w500/ztkUQFLlC19CCMYHW9o1zWhJRNq.jpg
202879,Star Wars: Skeleton Crew,778.961,Four ordinary kids search for their home planet after getting lost in the Star Wars galaxy.,2024-12-02,https://image.tmdb.org/t/p/w500/srQbJhLRKoAwRrNN5ga7webPHbC.jpg
115472,Exclusiv - Das Star-Magazin,745.471,,1994-03-01,https://image.tmdb.org/t/p/w500/A9MYh8E3YED3koL7mlRcRipRJWc.jpg
121290,Guido's Deko Queen,738.115,,2021-03-17,https://image.tmdb.org/t/p/w500/rsmoc9yjzxnOmxgOgV0tRpnIU78.jpg
237478,Crazy About You,525.679,"The story begins with the ambiguous relationship between friends Viola and Luma, who seem predestined to literally enter each other's lives. Born on the same day, in very different situations, they meet years later, united by coincidences that go beyond their birthday. From humble origins, Viola moves with her boyfriend Mavi to Angra dos Reis, where Luma lives a luxurious life and dates Rudá, who ends up meeting Viola by chance. Thus begins the duo's journey, which goes from a passion for recipes to an obsession with the same man, from the immediate connection to the point of starting to live their friend’s reality, 10 years later. A journey divided between complicity and rivalry, which includes them in a love quadrangle and is impacted by a series of circumstances, twists and surprises, such as the secret surrounding a murder.",2024-09-09,https://image.tmdb.org/t/p/w500/xq1X6H8pupwx0jeZpu4Piq0V5uL.jpg
1433,American Dad!,400.488,"The series focuses on an eccentric motley crew that is the Smith family and their three housemates: Father, husband, and breadwinner Stan Smith; his better half housewife, Francine Smith; their college-aged daughter, Hayley Smith; and their high-school-aged son, Steve Smith. Outside of the Smith family, there are three additional main characters, including Hayley's boyfriend turned husband, Jeff Fischer; the family's man-in-a-goldfish-body pet, Klaus; and most notably the family's zany alien, Roger, who is ""full of masquerades, brazenness, and shocking antics.""",2005-02-06,https://image.tmdb.org/t/p/w500/aC1q422YhQR7k82GB8gW4KoD91p.jpg
94605,Arcane,521.943,"Amid the stark discord of twin cities Piltover and Zaun, two sisters fight on rival sides of a war between magic technologies and clashing convictions.",2021-11-06,https://image.tmdb.org/t/p/w500/abf8tHznhSvl9BAElD2cQeRr7do.jpg
95897,Overflow,521.32,"Male college student Kazushi Sudou and his childhood friends, the Shirakawa sisters, end up bathing together.",2020-01-06,https://image.tmdb.org/t/p/w500/8RtwL5gxUvh9YViqjhNlVRvJpum.jpg
275720,Muscles & Brains,513.558,,2024-10-28,https://image.tmdb.org/t/p/w500/7pWO0zzKzxwyvOY5FFwWFHv83Ht.jpg
2261,The Tonight Show Starring Johnny Carson,347.185,"The Tonight Show Starring Johnny Carson is a talk show hosted by Johnny Carson under The Tonight Show franchise from 1962 to 1992. It originally aired during late-night. For its first ten years, Carson's Tonight Show was based in New York City with occasional trips to Burbank, California; in May 1972, the show moved permanently to Burbank, California. In 2002, The Tonight Show Starring Johnny Carson was ranked #12 on TV Guide's 50 Greatest TV Shows of All Time.",1962-10-01,https://image.tmdb.org/t/p/w500/oA8QVTGlAN511uCAMDN60aVQUs1.jpg
1408,House,561.944,"Dr. Gregory House, a drug-addicted, unconventional, misanthropic medical genius, leads a team of diagnosticians at the fictional Princeton–Plainsboro Teaching Hospital in New Jersey.",2004-11-16,https://image.tmdb.org/t/p/w500/3Cz7ySOQJmqiuTdrc6CY0r65yDI.jpg
136166,Lang Leve de Liefde,503.118,,2020-01-20,https://image.tmdb.org/t/p/w500/9lpvvzEl5kViIc2vUJG4QKzj2ds.jpg
34307,Shameless,517.331,"Chicagoan Frank Gallagher is the proud single dad of six smart, industrious, independent kids, who without him would be... perhaps better off. When Frank's not at the bar spending what little money they have, he's passed out on the floor. But the kids have found ways to grow up in spite of him. They may not be like any family you know, but they make no apologies for being exactly who they are.",2011-01-09,https://image.tmdb.org/t/p/w500/9akij7PqZ1g6zl42DQQTtL9CTSb.jpg
253905,When the Phone Rings,454.385,A rising politician and his mute wife's tense marriage begins to unravel after a call from a kidnapper turns their lives upside down.,2024-11-22,https://image.tmdb.org/t/p/w500/glWP5Y7CVeqrOjJpLckQjuLFjQJ.jpg
77169,Cobra Kai,494.633,"This Karate Kid sequel series picks up 30 years after the events of the 1984 All Valley Karate Tournament and finds Johnny Lawrence on the hunt for redemption by reopening the infamous Cobra Kai karate dojo. This reignites his old rivalry with the successful Daniel LaRusso, who has been working to maintain the balance in his life without mentor Mr. Miyagi.",2018-05-02,https://image.tmdb.org/t/p/w500/6GDW4EsgsXlYrL1ASb5eCHQK4er.jpg
46952,The Blacklist,493.181,"Raymond ""Red"" Reddington, one of the FBI's most wanted fugitives, surrenders in person at FBI Headquarters in Washington, D.C. He claims that he and the FBI have the same interests: bringing down dangerous criminals and terrorists. In the last two decades, he's made a list of criminals and terrorists that matter the most but the FBI cannot find because it does not know they exist. Reddington calls this ""The Blacklist"". Reddington will co-operate, but insists that he will speak only to Elizabeth Keen, a rookie FBI profiler.",2013-09-23,https://image.tmdb.org/t/p/w500/r935SMphvXppx5bJjbIBNx02fwc.jpg
6883,BBC World News America,686.97,BBC World News America is a current affairs news programme produced by BBC News especially targeted towards American audiences. It is presented by rotating presenters Caitríona Perry and Sumi Somaskanda.,2007-04-16,https://image.tmdb.org/t/p/w500/ahbTgC581tpCGg5M9LMXPcl6nq5.jpg
1695,Monk,345.085,"Adrian Monk was once a rising star with the San Francisco Police Department, legendary for using unconventional means to solve the department's most baffling cases. But after the tragic (and still unsolved) murder of his wife Trudy, he developed an extreme case of obsessive-compulsive disorder. Now working as a private consultant, Monk continues to investigate cases in the most unconventional ways.",2002-07-12,https://image.tmdb.org/t/p/w500/3axGMbUecXXOPSeG47v2i9wK5y5.jpg
44217,Vikings,479.193,"The adventures of Ragnar Lothbrok, the greatest hero of his age. The series tells the sagas of Ragnar's band of Viking brothers and his family, as he rises to become King of the Viking tribes. As well as being a fearless warrior, Ragnar embodies the Norse traditions of devotion to the gods. Legend has it that he was a direct descendant of Odin, the god of war and warriors.",2013-03-03,https://image.tmdb.org/t/p/w500/bQLrHIRNEkE3PdIWQrZHynQZazu.jpg
1421,Modern Family,314.031,"The Pritchett-Dunphy-Tucker clan is a wonderfully large and blended family. They give us an honest and often hilarious look into the sometimes warm, sometimes twisted, embrace of the modern family.",2009-09-23,https://image.tmdb.org/t/p/w500/gLAcu4VPCAb90oJvJ4nUJc5ZBQi.jpg
57706,Ranma ½,430.114,"Ranma Saotome, a teenage martial artist, and his father Genma travel to the 'cursed training ground' of Jusenkyo in China. There, despite the warnings of the Chinese guard, they fall into the cursed springs. From now on, whenever Ranma is doused in cold water, he turns into a girl and a cute, well-built redhead at that. Hot water changes him back into a man again, but only until the next time. To make matters worse, his father engages him to Akane Tendo, a girl who hates boys.",1989-04-15,https://image.tmdb.org/t/p/w500/qb1R5iLZcjIgdDIfXFQXmJadQPI.jpg
128839,La Brea,466.314,"An epic adventure begins when a massive sinkhole opens in the middle of Los Angeles, pulling hundreds of people and buildings into its depths. Those who fell in find themselves in a mysterious and dangerous primeval land, where they have no choice but to band together to survive. Meanwhile, the rest of the world desperately seeks to understand what happened. In the search for answers, one family torn apart by this disaster will have to unlock the secrets of this inexplicable event to find a way back to each other.",2021-09-28,https://image.tmdb.org/t/p/w500/wEo5pzSZ3MF4EzNvY2R1OZNX266.jpg
225385,Black Doves,387.903,"When a spy posing as a politician's wife learns her lover has been murdered, an old assassin friend joins her on a quest for truth — and vengeance.",2024-12-05,https://image.tmdb.org/t/p/w500/uoXtkm2P4HPPL8T3IBJ02G3hCC4.jpg
233971,We Are Criminal Police,452.737,"After graduating from the police academy, Qin Chuan and his friends return to their hometown as police officers, determined to pursue their dream of becoming detectives. Despite challenges, Qin Chuan’s career takes off when he proves his courage in a critical situation. Under the guidance of his superiors, he grows into a skilled detective, facing the weight of his responsibilities and the realities of the job.",2024-11-27,https://image.tmdb.org/t/p/w500/qFIaVIMwb6uaHwguLO1hUKh7Get.jpg
37680,Suits,451.822,"While running from a drug deal gone bad, Mike Ross, a brilliant young college-dropout, slips into a job interview with one of New York City's best legal closers, Harvey Specter. Tired of cookie-cutter law school grads, Harvey takes a gamble by hiring Mike on the spot after he recognizes his raw talent and photographic memory.",2011-06-23,https://image.tmdb.org/t/p/w500/vQiryp6LioFxQThywxbC6TuoDjy.jpg
155256,Happy Toon,451.583,,2010-07-02,https://image.tmdb.org/t/p/w500/wqOYz9kpRbznmYPdJFSwjZ4HCT9.jpg
71712,The Good Doctor,447.843,"Shaun Murphy, a young surgeon with autism and savant syndrome, relocates from a quiet country life to join a prestigious hospital's surgical unit. Unable to personally connect with those around him, Shaun uses his extraordinary medical gifts to save lives and challenge the skepticism of his colleagues.",2017-09-25,https://image.tmdb.org/t/p/w500/53P8oHo9cfOsgb1cLxBi4pFY0ja.jpg
1434,Family Guy,444.047,"Sick, twisted, politically incorrect and Freakin' Sweet animated series featuring the adventures of the dysfunctional Griffin family. Bumbling Peter and long-suffering Lois have three kids. Stewie (a brilliant but sadistic baby bent on killing his mother and taking over the world), Meg (the oldest, and is the most unpopular girl in town) and Chris (the middle kid, he's not very bright but has a passion for movies). The final member of the family is Brian - a talking dog and much more than a pet, he keeps Stewie in check whilst sipping Martinis and sorting through his own life issues.",1999-01-31,https://image.tmdb.org/t/p/w500/y0HUz4eUNUe3TeEd8fQWYazPaC7.jpg
4057,Criminal Minds,442.866,"An elite team of FBI profilers analyze the country's most twisted criminal minds, anticipating their next moves before they strike again. The Behavioral Analysis Unit's most experienced agent is David Rossi, a founding member of the BAU who returns to help the team solve new cases.",2005-09-22,https://image.tmdb.org/t/p/w500/wLMQebhTApmn4F6Fzg6FovdwVvL.jpg
203599,Scoop,442.845,"Scoop is a comprehensive information programme of Television Broadcasts Limited.

The content of the program is mainly based on entertainment news and personal follow-up of the artists, and will also be interspersed with the latest trends of TVB dramas and artists. Some entertainment news content clips will be rebroadcast on the next day's ""Entertainment Live"".

This program will be broadcast on Jade Channel from 19:30-20:00 (Hong Kong time) from June 6, 2005, and will be broadcast every day from March 3, 2019, and will be broadcast on myTV (later myTV SUPER) to provide ""Program Review"".",2005-06-06,https://image.tmdb.org/t/p/w500/qo6y0XvSBlKM3XCbYVdcR3a6qyQ.jpg
34860,Ninja Boy Rantaro,435.426,"Rantarō, Shinbei and Kirimaru are ninja  apprentices in the Ninja Gakuen, where first grade ones are called  ""Nintamas"". They must learn  everything a ninja must know, but as for our heroes, money, food or  playing are more interesting. The series show the everyday adventures of  our heroes.",1993-04-10,https://image.tmdb.org/t/p/w500/raKlXyICQBeTxYavErIRybR6g8d.jpg
95057,Superman & Lois,432.213,"After years of facing megalomaniacal supervillains, monsters wreaking havoc on Metropolis, and alien invaders intent on wiping out the human race, The Man of Steel aka Clark Kent and Lois Lane come face to face with one of their greatest challenges ever: dealing with all the stress, pressures and complexities that come with being working parents in today's society.",2021-02-23,https://image.tmdb.org/t/p/w500/qJ6ndkbqgqS1n7ETi0YHhcjASym.jpg
60625,Rick and Morty,431.239,"Rick is a mentally-unbalanced but scientifically gifted old man who has recently reconnected with his family. He spends most of his time involving his young grandson Morty in dangerous, outlandish adventures throughout space and alternate universes. Compounded with Morty's already unstable family life, these events cause Morty much distress at home and school.",2013-12-02,https://image.tmdb.org/t/p/w500/gdIrmf2DdY5mgN6ycVP0XlzKzbE.jpg
278318,Misplacement,426.947,"Singer Shen Zhiqiu infiltrates the powerful Yin family to uncover the truth behind her sister's betrayal. Unexpectedly engaged to Yin Heng, the third master, she navigates the family's dangers to deliver a masterful act of revenge.",2024-11-30,https://image.tmdb.org/t/p/w500/2YHlxywh97YcLWpYZiiHtu8GkvC.jpg
207333,One Hundred Years of Solitude,424.763,"In the mythical town Macondo, seven generations of the Buendía family navigate love, oblivion and the inescapability of their past — and their fate.",2024-12-11,https://image.tmdb.org/t/p/w500/oX8CAf3eyCknNPXX1IxdmAuv6jH.jpg
135137,Morning Live,423.692,Kym Marsh and Gethin Jones present a weekday morning magazine programme featuring a lively and entertaining mixture of topical discussion and expert advice.,2020-10-26,https://image.tmdb.org/t/p/w500/lUuIvhU5bycqzRk5a2jLHvgJXCB.jpg
10536,The Mike Douglas Show,423.139,"The Mike Douglas Show is an American daytime television talk show hosted by Mike Douglas that originally aired only in the Cleveland area during much of its first two years on the air. It then went into syndication in 1963 and remained on television until 1982. It was distributed by Westinghouse Broadcasting and for much of its run, originated from studios of two of the company's TV stations in Cleveland and Philadelphia.",1961-12-11,https://image.tmdb.org/t/p/w500/qNk97cbF3dZyhkfIcJhjFDD64sM.jpg
63174,Lucifer,422.913,"Bored and unhappy as the Lord of Hell, Lucifer Morningstar abandoned his throne and retired to Los Angeles, where he has teamed up with LAPD detective Chloe Decker to take down criminals. But the longer he's away from the underworld, the greater the threat that the worst of humanity could escape.",2016-01-25,https://image.tmdb.org/t/p/w500/ekZobS8isE6mA53RAiGDG93hBxL.jpg
1668,Friends,412.735,"Six young people from New York City, on their own and struggling to survive in the real world, find the companionship, comfort and support they get from each other to be the perfect antidote to the pressures of life.",1994-09-22,https://image.tmdb.org/t/p/w500/2koX1xLkpTQM4IZebYvKysFW1Nh.jpg
210865,Golden Boy,409.732,"A young girl is forced to marry a rich groom. The groom is not only rich, but also allows himself to live without any restrictions or obligations. Will married life change his habits? And how will such a man be accepted by a good-hearted wife?",2022-09-23,https://image.tmdb.org/t/p/w500/cgf5R2XrfRQGp2sTu3cncbnFxRy.jpg
13805,A Girl's Guide to 21st Century Sex,408.655,"A Girl's Guide to 21st Century Sex is a documentary TV series about sex, which ran in eight episodes on Channel 5 and was presented by Dr. Catherine Hood. The 45-minute long episodes were broadcast on Monday nights. The series started on 30 October 2006, with the final programme broadcast on 18 December 2006.

Each episode explained a sex position and covered a sexually transmitted disease. Additionally, the following topics were discussed: sex among handicapped and overweight people, penis enlargement devices, penis enlargement surgery, sexual violence against men and penis removal, tantric sex, the g-spot, erectile dysfunction, sex reassignment surgery, cosmetic surgery of the vagina, swinging, lichen sclerosus, the use of recreational drugs during sex, male homosexual sex in public toilets, full body plastic wrap bondage, and sex dolls.

The programme included close shots of the male and female body as well as footage of sexual intercourse and ejaculation filmed with an internal camera placed inside the vagina. These scenes were filmed using Australian-born pornographic actress Elizabeth Lawrence and English-born pornographic actor Stefan Hard.",2006-10-30,https://image.tmdb.org/t/p/w500/9NSX2YrFGBIih0XqRedsSbDVx4U.jpg
60059,Better Call Saul,408.601,"Six years before Saul Goodman meets Walter White. We meet him when the man who will become Saul Goodman is known as Jimmy McGill, a small-time lawyer searching for his destiny, and, more immediately, hustling to make ends meet. Working alongside, and, often, against Jimmy, is “fixer” Mike Ehrmantraut. The series tracks Jimmy’s transformation into Saul Goodman, the man who puts “criminal” in “criminal lawyer"".",2015-02-08,https://image.tmdb.org/t/p/w500/fC2HDm5t0kHl7mTm7jxMR31b7by.jpg
764,Midsomer Murders,407.862,"The peacefulness of the Midsomer community is shattered by violent crimes, suspects are placed under suspicion, and it is up to a veteran DCI and his young sergeant to calmly and diligently eliminate the innocent and ruthlessly pursue the guilty. ",1997-03-23,https://image.tmdb.org/t/p/w500/pz7tsWxe0TTdfJnWPjZAEnrSl5M.jpg
76479,The Boys,404.916,A group of vigilantes known informally as “The Boys” set out to take down corrupt superheroes with no more than blue-collar grit and a willingness to fight dirty.,2019-07-25,https://image.tmdb.org/t/p/w500/2zmTngn1tYC1AvfnrFLhxeD82hz.jpg
218843,The Seven Deadly Sins: Four Knights of the Apocalypse,404.881,"As a prophecy of doom unfolds on the peaceful land of Britannia, a purehearted boy sets out on a journey of discovery — and revenge.",2023-10-08,https://image.tmdb.org/t/p/w500/6SWVJvCIC9B16u6wASZ8FEaNssz.jpg
1620,CSI: Miami,404.862,"CSI: Miami follows Crime Scene Investigators working for the Miami-Dade Police Department as they use physical evidence, similar to their Las Vegas counterparts, to solve grisly murders. The series mixes deduction, gritty subject matter, and character-driven drama in the same vein as the original series in the CSI franchise, except that the Miami CSIs are cops first, scientists second.",2002-09-23,https://image.tmdb.org/t/p/w500/pNW64pjaHvf6purNaFhq4SHYRfl.jpg
4607,Lost,404.587,"Stripped of everything, the survivors of a horrific plane crash  must work together to stay alive. But the island holds many secrets.",2004-09-22,https://image.tmdb.org/t/p/w500/og6S0aTZU6YUJAbqxeKjCa3kY1E.jpg
1028,Holby City,403.231,"Drama series about life on the wards of Holby City Hospital, following the highs and lows of the staff and patients.",1999-01-12,https://image.tmdb.org/t/p/w500/cyQZGDCfRFdmwiH4519c34UKnG.jpg
1402,The Walking Dead,401.863,Sheriff's deputy Rick Grimes awakens from a coma to find a post-apocalyptic world dominated by flesh-eating zombies. He sets out to find his family and encounters many other survivors along the way.,2010-10-31,https://image.tmdb.org/t/p/w500/n7PVu0hSz2sAsVekpOIoCnkWlbn.jpg
226529,Light Shop,393.962,"In a mysterious shop that sells lamps, the dead may return to the world of the living, while the living may not walk out alive.",2024-12-04,https://image.tmdb.org/t/p/w500/iRgH73xibpeNZ8zzPDkIpxuoKgC.jpg
60574,Peaky Blinders,391.452,"A gangster family epic set in 1919 Birmingham, England and centered on a gang who sew razor blades in the peaks of their caps, and their fierce boss Tommy Shelby, who means to move up in the world.",2013-09-12,https://image.tmdb.org/t/p/w500/vUUqzWa2LnHIVqkaKVlVGkVcZIW.jpg
16286,"I am Betty, the Ugly one",385.876,"Taking place mainly in Bogotá, Colombia, Betty La Fea is essentially a Cinderella comedy about the rise of poor, ugly 'Betty' Pinzón and the fall of rich, handsome Armando Mendoza. Armando is a very incompetent playboy with a scheme to turn a huge profit as the new President of Eco Moda, a famous clothing manufacturing company, but his scheme is doomed because of his faulty mathematics. Because Betty, his secretary (and economics wizard), is in love with him, she helps Armando deceive the Board of Directors as he loses money and brings the company to ruin.

Betty, la Fea is arguably the most successful telenovela of all time and one of the most popular television shows in the world. It is the first telenovela to have been remade worldwide and has been regarded as bringing the telenovela to new levels of success.",1999-10-25,https://image.tmdb.org/t/p/w500/iEBOiXiDGaxVR6w8aKgG5MEusuO.jpg
1871,EastEnders,383.053,"The everyday lives of working-class residents of Albert Square, a traditional Victorian square of terrace houses surrounding a park in the East End of London's Walford borough.",1985-02-19,https://image.tmdb.org/t/p/w500/z4jgyI5TpoRZiJTNchkVkMrGQyz.jpg
153312,Tulsa King,382.804,"Just after he is released from prison after 25 years, New York mafia capo Dwight “The General” Manfredi is unceremoniously exiled by his boss to set up shop in Tulsa, Okla. Realizing that his mob family may not have his best interests in mind, Dwight slowly builds a “crew” from a group of unlikely characters, to help him establish a new criminal empire in a place that to him might as well be another planet.",2022-11-13,https://image.tmdb.org/t/p/w500/zMFAdj30K84Sz90bCd6ePwiAO37.jpg
105194,Three Guys and Three Girls,380.29,It looks like we don't have any synopsis for this title yet. Be the first to contribute.,1996-10-21,https://image.tmdb.org/t/p/w500/k7WJy6YdiONTn5Y9PQiu0AN23MP.jpg
71728,Young Sheldon,379.004,"The early life of child genius Sheldon Cooper, later seen in The Big Bang Theory.",2017-09-25,https://image.tmdb.org/t/p/w500/kidkbZRBGbsEIrX7pODRSKi9ipl.jpg
84773,The Lord of the Rings: The Rings of Power,371.252,"Beginning in a time of relative peace, we follow an ensemble cast of characters as they confront the re-emergence of evil to Middle-earth. From the darkest depths of the Misty Mountains, to the majestic forests of Lindon, to the breathtaking island kingdom of Númenor, to the furthest reaches of the map, these kingdoms and characters will carve out legacies that live on long after they are gone.",2022-09-01,https://image.tmdb.org/t/p/w500/mYLOqiStMxDK3fYZFirgrMt8z5d.jpg
95479,Jujutsu Kaisen,364.96,"Yuji Itadori is a boy with tremendous physical strength, though he lives a completely ordinary high school life. One day, to save a classmate who has been attacked by curses, he eats the finger of Ryomen Sukuna, taking the curse into his own soul. From then on, he shares one body with Ryomen Sukuna. Guided by the most powerful of sorcerers, Satoru Gojo, Itadori is admitted to Tokyo Jujutsu High School, an organization that fights the curses... and thus begins the heroic tale of a boy who became a curse to exorcise a curse, a life from which he could never turn back.",2020-10-03,https://image.tmdb.org/t/p/w500/fHpKWq9ayzSk8nSwqRuaAUemRKh.jpg
5920,The Mentalist,363.47,"Patrick Jane, a former celebrity psychic medium, uses his razor sharp skills of observation and expertise at ""reading"" people to solve serious crimes with the California Bureau of Investigation.",2008-09-23,https://image.tmdb.org/t/p/w500/acYXu4KaDj1NIkMgObnhe4C4a0T.jpg
1877,Phineas and Ferb,363.448,"Each day, two kindhearted suburban stepbrothers on summer vacation embark on some grand new project, which annoys their controlling sister, Candace, who tries to bust them. Meanwhile, their pet platypus plots against evil Dr. Doofenshmirtz.",2007-08-17,https://image.tmdb.org/t/p/w500/haFnEJx44Uk4w2YEzQpdclVURlS.jpg
2661,Kamen Rider,356.597,"Takeshi Hongo is a promising young man with a passion for motorcycle racing. However, his dreams are suddenly ruined when he gets kidnapped by Shocker, the evil secret organization planning to dominate the world. After being remodeled into a cyborg, Takeshi escapes and swears to protect the world from the inhuman monsters.",1971-04-03,https://image.tmdb.org/t/p/w500/fIJNVBa6MJStPiOvhLV69nAdu0e.jpg
1418,The Big Bang Theory,351.222,Physicists Leonard and Sheldon find their nerd-centric social circle with pals Howard and Raj expanding when aspiring actress Penny moves in next door.,2007-09-24,https://image.tmdb.org/t/p/w500/ooBGRQBdbGzBxAVfExiO8r7kloA.jpg
